id;name;description
0;Extra Luck Bonus;Keys and lockpicks drop at four times the usual rate and double Lucky and Unlucky title points
1;Elonian Support Bonus;Double Sunspear and Lightbringer points
2;Zaishen Bounty Bonus;Double copper Zaishen Coin rewards for Zaishen bounties
3;Factions Elite Bonus;The Deep and Urgoz's Warren can be entered from Kaineng Center
4;Northern Support Bonus;Double Asura, Deldrimor, Ebon Vanguard, or Norn reputation points
5;Zaishen Mission Bonus;Double copper Zaishen Coin rewards for Zaishen missions
6;Pantheon Bonus;Free passage to the Underworld and the Fissure of Woe
7;Faction Support Bonus;Double Kurzick and Luxon title track points for exchanging faction
8;Zaishen Vanquishing Bonus;Double copper Zaishen Coin rewards for Zaishen vanquishes