id;name;description
0;Random Arenas Bonus;Double Balthazar faction and Gladiator title points in Random Arenas
1;Guild Versus Guild Bonus;Double Balthazar faction and Champion title points in GvG
2;Competitive Mission Bonus;Double Balthazar and Imperial faction in the Jade Quarry and Fort Aspenwood
3;Heroes' Ascent Bonus;Double Balthazar faction and Hero title points in Heroes' Ascent
4;Codex Arena Bonus;Double Balthazar faction and Codex title points in Codex Arena
5;Alliance Battle Bonus;Double Balthazar and Imperial faction in Alliance Battles