skillId;skillName;skillDescription
325;Coup de diversion;Melee Attack. Swipe your weapon at the target, dealing no damage but disrupting the target's current action (and the actions of foes adjacent to your target).
326;Attaque du protecteur;Melee Attack.  If this attack strikes a moving foe, you strike for 10...34...40 more damage.
327;Frappe du griffon;Melee Attack. If this attack hits, you strike for +5...17...20 damage. If this attack is blocked, your target is knocked down and suffers 10...29...34 damage.
328;Frappe pure;Sword Attack.  If Pure Strike hits, you strike for +1...24...30 damage. If you are not using a stance, Pure Strike cannot be blocked.
329;Brise-crâne;Elite Melee Attack. If it hits, this attack interrupts the target's current action. If that foe was casting a spell, that foe is Dazed for 10 seconds.
330;Hache cyclone;Axe Attack. Perform a spinning axe attack striking for +4...10...12 damage to all adjacent opponents.
331;Coup de marteau;Hammer Attack. Lose all adrenaline. If Hammer Bash hits, your target is knocked down.
332;Attaque du taureau;Melee Attack. If this attack hits a moving foe, you strike for +5...25...30 damage, and your target is knocked down.
333;"Je vous vengerai !";Shout. For each dead ally, you gain 10 seconds of +3...6...7 Health regeneration and your attack speed increases by 25%.
334;Ratissage;Axe Attack. If this attack hits a foe suffering from a Deep Wound, you strike for +1...8...10 damage, and that foe becomes Crippled for 15 seconds.
335;Clivage;Elite Axe Attack. If this attack hits, you strike for +10...26...30 damage.
336;Frappe du bourreau;Axe Attack. If this attack hits, you strike for +10...34...40 damage.
337;Démembrement;Axe Attack. If it hits, this axe blow will inflict a Deep Wound on the target foe, lowering that foe's maximum Health by 20% for 5...17...20 seconds.
338;Eviscération;Elite Axe Attack. If Eviscerate hits, you strike for +1...25...31 damage and inflict a Deep Wound, lowering your target's maximum Health by 20% for 5...17...20 seconds.
339;Coup pénétrant;Axe Attack. If this attack hits, you strike for +5...17...20 damage.  This axe attack has 20% armor penetration.
340;Taillade d'interruption;Axe Attack. If it hits, this attack interrupts the target's current action. If that action was a skill, that skill is disabled for an additional 20 seconds.
341;Coup rapide;Axe Attack. If this attack hits, you strike for +1...16...20 damage. If Swift Chop is blocked, target foe takes 1...16...20 damage and suffers a Deep Wound for 20 seconds.
342;Hache tournante;Axe Attack. If this attack hits a foe suffering from a Deep Wound, you strike for 1...16...20 more damage and that foe suffers from Weakness for 20 seconds.
343;"Pour la justice !";Shout. For 20 seconds, whenever you gain adrenaline, you gain 100% more.
344;Rafale;Stance. For 5 seconds, your attack rate is increased by 33%, but you deal 25% less damage.
345;Pose défensive;Stance. For 1...4...5 second[s], you have a 75% chance to block melee and projectile attacks. When Defensive Stance ends, you gain one strike of adrenaline for each melee attack skill you have (maximum 0...3...4).
346;Frénésie;Stance. For 8 seconds, you attack 33% faster but take double damage.
347;Résistance à la douleur;Skill. For 7...16...18 seconds you have an additional 90...258...300 Health.
348;"Prenez garde !";Shout. Party members within earshot gain +5...21...25 armor for 10 seconds. This shout ends after 10 incoming attacks.
349;Sprint;Stance. For 8...13...14 seconds, you move 25% faster.
350;Coup ventral;Hammer Attack. If this attack strikes a foe who is knocked down, the resulting dust cloud will blind adjacent foes for 3...6...7 seconds.
351;Coup puissant;Hammer Attack. If this attack hits, you strike for +10...34...40 damage.
352;Coup écrasant;Hammer Attack. If this attack hits, you strike for +1...16...20 damage. If you hit a knocked-down foe you inflict a Deep Wound, lowering your target's maximum Health by 20% for 5...17...20 seconds.
353;Swing brutal;Hammer Attack. Attack all adjacent foes. Each foe you hit is struck for +1...16...20 damage.
354;Marteau pilon;Elite Hammer Attack. Target foe and all adjacent foes are knocked down. (50% failure chance with Hammer Mastery 4 or less.)
355;Marteau dévastateur;Elite Hammer Attack. If Devastating Hammer hits, your target is knocked down and suffers from Weakness for 5...17...20 seconds.
356;Coup impérieux;Hammer Attack. If this attack hits, you strike for +5...17...20 damage. If Irresistible Blow is blocked, your target is knocked down and takes 5...17...20 damage.
357;Contrecoup;Hammer Attack. If this attack hits an attacking foe, that foe is knocked down.
358;Brise-échine;Elite Hammer Attack. If Backbreaker hits, you strike for +1...16...20 damage and your target is knocked down.  If you have 8 Strength or higher, this knockdown lasts 4 seconds.
359;Coup de brute;Hammer Attack. Lose all adrenaline. If this attack hits a foe suffering from Weakness, that foe is knocked down and you strike for +1...24...30 damage.
360;Coup de boutoir;Hammer Attack. If this hammer blow hits, your target will suffer from Weakness for 5...17...20 seconds.
361;Sceau de dolyak;Signet. For 8...18...20 seconds, you have +10...34...40 armor and cannot be knocked down, but your movement is slowed by 75%.
362;Adresse du Guerrier;Skill. For 5...10...11 seconds, your melee attacks cannot be blocked.
363;Coup de bouclier;Skill. For 5...10...11 seconds, while wielding a shield, the next attack skill used against you is blocked. If it was a melee skill, your attacker is knocked down and that skill is disabled for an additional 15 seconds.
364;"Chargez !";Elite Shout. Allies in earshot lose the Crippled condition. For 5...11...13 seconds, these allies move 33% faster.
365;"A moi la victoire !";Elite Shout. You gain 10...56...68 Health and 3...6...7 Energy for each condition suffered by target foe.
366;"Craignez-moi !";Shout. All nearby foes lose 1...3...4 Energy. For 1...12...15 second[s], your melee attacks gain +5...25...30% chance of a critical hit against stationary foes.
367;"Levez les boucliers !";Shout. For 5...10...11 seconds, you and all party members within earshot gain +60 armor against incoming projectile attacks.
368;"Je survivrai !";Shout. You gain +3 Health regeneration for each condition you are suffering. This regeneration expires after 5...10...11 seconds.
370;Pose du berserker;Stance. For 5...10...11 seconds, you attack 33% faster and gain 50% more adrenaline. Berserker Stance ends if you use a skill.
371;Pose d'équilibre;Stance. For 8...18...20 seconds, you cannot be knocked down and you do not suffer extra damage from a critical attack.
372;Défense du gladiateur;Elite Stance. For 5...10...11 seconds, you have a 75% chance to block incoming attacks. Whenever you block a melee attack this way, the attacker suffers 5...29...35 damage.
373;Déviation des flèches;Stance. For 1...5...6 second[s], you have a 75% chance to block attacks. If you block a projectile attack, adjacent foes suffer from Bleeding for 5...13...15 seconds.
374;Endurance du Guerrier;Elite Skill. For 5...29...35 seconds, you gain 3 Energy each time you hit with a melee attack. Warrior's Endurance cannot raise your Energy above 10...22...25.
375;Pose de combat des Nains;Elite Stance. For 5...10...11 seconds, if you are wielding a hammer, you attack 33% faster, you gain +40 armor, and your attack skills interrupt foes when they hit.
376;Pose de discipline;Stance. For 1...3...4 second[s], you gain +10 armor and have a 75% chance to block attacks. Disciplined Stance ends if you use an adrenal skill.
377;Pose prudente;Stance. For 1...5...6 second[s], you block any attack skills used against you. For each successful block, you gain adrenaline and 5 Energy. Wary Stance ends if you use a skill.
378;Pose du bouclier;Stance. For 1...5...6 second[s], while wielding a shield, you have a 75% chance to block incoming attacks, and damage is reduced by 2 for each rank of Strength (maximum 15 damage reduction).
379;Charge du taureau;Elite Stance. For 5...10...11 seconds, you move 33% faster and if you strike a moving foe in melee, that foe is knocked down. Bull's Charge ends if you use a skill.
380;Défense de Bonetti;Stance. For 5...10...11 seconds, you have a 75% chance to block melee and projectile attacks. You gain 5 Energy for each successful melee attack blocked. Bonetti's Defense ends if you use a skill.
381;Cent lames;Elite Skill. For 15 seconds, whenever you attack with a sword, all adjacent foes take 10...22...25 slashing damage.
382;Tranche-artère;Sword Attack. If this attack hits, the opponent begins Bleeding for 5...21...25 seconds, losing Health over time.
383;Taillade de Galrath;Sword Attack.  This attack strikes for +1...32...40 damage if it hits.
384;Entaille;Sword Attack. If this attack hits a Bleeding foe, you strike for 5...17...20 more damage and that foe suffers a Deep Wound, lowering that foe's maximum Health by 20% for 5...17...20 seconds.
385;Botte fatale;Sword Attack. Lose all adrenaline. If Final Thrust hits, you deal 1...32...40 more damage. This damage is doubled if your target was below 50% Health.
386;Lame chercheuse;Sword Attack. If this attack hits you strike for +1...16...20 damage. If Seeking Blade is blocked, your target begins Bleeding for 25 seconds and takes 1...16...20 damage.
387;Riposte;Skill.  For 8 seconds, while you have a sword equipped, you block the next melee attack against you and your attacker is struck for 20...68...80 damage.
388;Riposte mortelle;Skill. For 8 seconds, while you have a sword equipped, you block the next melee attack against you, and your attacker is struck for 15...75...90 damage and begins Bleeding for 3...21...25 seconds.
389;Prospérité;Elite Skill. All of your attack skills become recharged. You gain 2...6...7 Energy for each skill recharged by Flourish.
390;Taillade sauvage;Sword Attack. If this attack hits, it interrupts target foe's action. If that action was a spell, you deal 1...32...40 extra damage.
391;Tir du chasseur;Bow Attack. If this attack hits, your target bleeds for 3...21...25 seconds.
392;Immobilisation;Bow Attack. If Pin Down hits, your target is Crippled for 3...13...15 seconds.
393;Tir incapacitant;Elite Bow Attack. If Crippling Shot hits, your target becomes Crippled for 1...9...11 second[s]. This attack cannot be blocked.
394;Tir puissant;Bow Attack. If Power Shot hits, target foe takes 25...45...50 damage.
395;Tir de barrage;Elite Bow Attack. All your preparations are removed. Shoot arrows at target foe and up to 5 foes adjacent to your target. These arrows strike for +5...17...20 damage if they hit.
396;Tir double;Bow Attack. Shoot two arrows simultaneously at target foe.  These arrows deal 25% less damage.
397;Tir rapide;Elite Bow Attack. Shoot an arrow that moves twice as fast.
398;Attaque pénétrante;Bow Attack. If Penetrating Attack hits, you strike for +5...21...25 damage and this attack has 10% armor penetration.
399;Tir de diversion;Bow Attack. If Distracting Shot hits, it interrupts target foe's action but deals only 1...13...16 damage. If the interrupted action was a skill, that skill is disabled for an additional 20 seconds.
400;Tir de précision;Bow Attack. If Precision Shot hits, you strike for +3...9...10 damage. Precision Shot cannot be blocked. This action is easily interrupted.
402;Tir déterminé;Bow Attack. If Determined Shot hits, you strike for +5...17...20 damage. If Determined Shot fails to hit, all of your attack skills are recharged.
403;Tir ciblé;Bow Attack. Shoot an arrow that moves 3 times faster and cannot be blocked.
404;Flèche empoisonnée;Elite Bow Attack. If Poison Arrow hits, your target becomes Poisoned for 5...17...20 seconds.
405;Tir du serment;Elite Bow Attack. If Oath Shot hits, all of your skills except Oath Shot are recharged. If it misses, all of your skills are disabled for 10...5...4 seconds. (50% miss chance with Expertise 7 or less.)
406;Tir débilitant;Bow Attack. If Debilitating Shot hits, your target loses 1...8...10 Energy.
407;Tir à bout portant;Bow Attack. Shoot an arrow that has half the normal range, but strikes for +10...34...40 damage.
408;Coup cérébral;Bow Attack. If Concussion Shot hits while target foe is casting a spell, the spell is interrupted and your target is Dazed for 5...17...20 seconds.  This attack deals only 1...13...16 damage.
409;Tir de représailles;Elite Bow Attack. If Punishing Shot hits, you strike for +10...18...20 damage and your target is interrupted.
411;Charme animal;Skill. Charm target animal. Once charmed, your animal companion will travel with you whenever you have Charm Animal equipped. You cannot charm an animal that is more than 4 levels above you.
412;Cri de protection;Shout.  For 120 seconds, your animal companion has a 5...17...20 base damage reduction.
415;Cri de hâte;Shout.  For 30 seconds, your animal companion has a 33% faster attack speed and moves 33% faster.
422;Renaissance animale;Skill. Resurrect all nearby allied animal companions. They come back to life with 10...77...94% Health.
423;Lien symbiotique;Shout. For 120...264...300 seconds, your animal companion gains 1...3...3 Health regeneration, and half of all damage dealt to your animal companion is redirected to you.
424;Jet de terre;Skill. Target touched foe and foes adjacent to your target become Blinded for 3...13...15 seconds.
425;Esquive;Stance. For 5...10...11 seconds, you move 33% faster and have a 27...65...75% chance to block incoming projectiles. Dodge ends if you attack.
426;Tir sauvage;Bow Attack. If Savage Shot hits, your target's action is interrupted.  If that action was a spell, you strike for +13...25...28 damage.
427;Sceau antidote;Signet. Cleanse yourself of Poison, Disease, and Blindness, and one additional condition.
428;Flèches incendiaires;Elite Bow Attack. Shoot arrows at target foe and up to 2 foes near your target. Those foes are set on fire for 1...3...3 second[s].
429;Flèches de Melandru;Elite Preparation. For 18 seconds, whenever your arrows hit, they cause Bleeding for 3...21...25 seconds, and if they hit a target who is under an enchantment, they do +8...24...28 damage.
430;Pari du tireur;Elite Preparation. For 18 seconds, you gain 5...9...10 Energy whenever your arrows hit, but lose 10 Energy whenever your arrows fail to strike.
431;Flèches de feu;Preparation. For 24 seconds, your arrows explode on contact, dealing 3...15...18 fire damage to target and all adjacent foes.
432;Lecture du vent;Preparation. For 24 seconds, your arrows move twice as fast and deal 3...9...10 extra damage.
433;Flèches enflammées;Preparation. For 24 seconds, your arrows deal fire damage and hit for an additional 3...20...24 fire damage.
434;Gaz suffocant;Preparation. For 1...10...12 seconds, your arrows deal 1...7...8 more damage and spread Choking Gas to all adjacent foes on impact.  Choking Gas interrupts foes attempting to cast spells.
435;Application de poison;Preparation. For 24 seconds, foes struck by your physical attacks become Poisoned for 3...13...15 seconds.
436;Bien-être animal;Skill.  You heal your animal companion for 20...87...104 Health. If your companion is dead, it is resurrected with 10...48...58% Health. If you have Comfort Animal equipped, your animal companion will travel with you.
437;Assaut bestial;Pet Attack. Your animal companion attempts a Bestial Pounce that deals +5...17...20 damage. If the attack strikes a foe who is casting a spell, that foe is knocked down.
438;Assaut de mutilation;Pet Attack. Your animal companion attempts a Maiming Strike that deals +5...17...20 damage. If that attack hits a moving foe that foe becomes Crippled for 3...13...15 seconds.
439;Coup barbare;Pet Attack. Your animal companion attempts a Feral Lunge that deals +5...29...35 damage. If the attack strikes a foe who is attacking, that foe suffers from Bleeding for 5...21...25 seconds.
440;Assaut de charognard;Pet Attack. Your animal companion attempts a Scavenger Strike that deals +10...22...25 damage. If the attack strikes a foe who is suffering a condition, you gain 3...13...15 Energy.
441;Assaut de Melandru;Pet Attack. Your animal companion attempts a Melandru's Assault that deals +5...17...20 damage to all nearby foes.
442;Attaque féroce;Elite Pet Attack. Your animal companion attempts a Ferocious Strike that deals  +13...25...28 damage. If that attack hits, you gain adrenaline and 3...9...10 Energy.
443;Coup du prédateur;Pet Attack. Your animal companion attempts a Predator's Pounce that deals +5...29...35 damage. If that attack hits, your animal companion gains 5...41...50 Health.
444;Coup brutal;Pet Attack. Your animal companion attempts a Brutal Strike that deals +5...29...35 damage. If that attack strikes a foe whose Health is below 50%, that foe takes an additional +5...29...35 damage.
445;Attaque d'interruption;Pet Attack. Your animal companion attempts a Disrupting Lunge that deals +1...10...12 damage. If that attack strikes a foe using a skill that skill is interrupted and is disabled for an additional 20 seconds.
446;Onguent des trolls;Skill. For 13 seconds, you gain +3...9...10 Health regeneration.
447;Cri d'Otyugh;Shout. For 10...22...25 seconds, your animal companion gains +24 armor and cannot be blocked.
448;Echappatoire;Elite Stance. For 1...7...8 second[s], you move 33% faster and have a 75% chance to block attacks.
449;Pose de pratique;Elite Stance. For 20...32...35 seconds, your Preparations recharge 50% faster and last 30...126...150% longer.
450;Tourbillon défensif;Stance. For 8...18...20 seconds, you have 75% chance to block attacks. Whenever you block a projectile in this way, adjacent foes take 5...10...11 damage.
451;Résistance de Melandru;Elite Stance. For 8...18...20 seconds, you gain +4 Health regeneration and +1 Energy regeneration for each condition and hex you are suffering.
452;Défenses du Drider;Stance. For 5...10...11 seconds, you gain 75% chance to block attacks and 34...55...60 armor against elemental damage.
453;Réflexes foudroyants;Stance. For 5...10...11 seconds, you have a 75% chance to block melee and projectile attacks, and you attack 33% faster.
454;Fureur du tigre;Stance. All your non-attack skills are disabled for 5 seconds. For 5...10...11 seconds, you attack 25% faster.
455;Chasseur de tempêtes;Stance. For 8...18...20 seconds, you move 25% faster, and you gain 1...4...5 Energy whenever you take elemental damage.
456;Vitesse du serpent;Stance. For 15...27...30 seconds, recharge times for your skills are reduced by 33%. Serpent's Quickness ends if your Health drops below 50%.
457;Piège à poussière;Trap. When Dust Trap is triggered, every second (for 5 seconds total), all nearby foes are Blinded for 3...7...8 seconds and take 10...22...25 damage. While activating this skill, you are easily interrupted. Dust Trap ends after 90 seconds.
458;Piège barbelé;Trap. When Barbed Trap is triggered, all nearby foes are struck for 7...20...23 piercing damage, become Crippled, and begin Bleeding for 3...21...25 seconds.  Barbed Trap ends after 90 seconds.  While activating this skill, you are easily interrupted.
459;Piège de flammes;Trap. When Flame Trap is triggered, every second (for 3 seconds total), all nearby foes are struck for 5...17...20 fire damage and set on fire for 1...3...3 second[s]. Flame Trap ends after 90 seconds. While activating this skill, you are easily interrupted.
460;Source de guérison;Trap. For 10 seconds, all adjacent allies are healed for 15...51...60 every 2 seconds. While activating this skill, you are easily interrupted.
461;Piège à pointes;Elite Trap. When Spike Trap is triggered, every second (for 2 seconds), all nearby foes are struck for 10...34...40 piercing damage, become Crippled for 3...21...25 seconds, and are knocked down. Spike Trap ends after 90 seconds. While activating this skill, you are easily interrupted.
462;Hiver;Nature Ritual. Create a level 1...8...10 spirit. For creatures within its range, all elemental damage is cold damage instead. This spirit dies after 30...126...150 seconds.
463;Vannage;Nature Ritual. Create a level 1...8...10 spirit.  Non-spirit creatures within range take 4 additional damage whenever they take physical damage.  This spirit dies after 30...126...150 seconds.
464;Voie d'extinction;Nature Ritual. Create a level 1...8...10 spirit. If a non-spirit creature within range dies, Edge of Extinction deals 14...43...50 damage to all creatures of the same type that are below 90% Health and within range of the spirit. This spirit dies after 30...126...150 seconds.
465;Grand brasier;Elite Nature Ritual. Create a level 1...8...10 spirit. For non-spirit creatures within its range, all physical damage is fire damage instead. This spirit dies after 30...126...150 seconds.
466;Brasier;Nature Ritual.  Create a level 1...8...10 spirit. For non-spirit creatures within its range, all arrows that hit strike for fire damage. This spirit dies after 30...126...150 seconds.
467;Saison fertile;Nature Ritual. Create a level 1...8...10 spirit. Non-spirit creatures within range have +50...130...150 maximum Health and gain +8 armor. This spirit dies after 15...39...45 seconds.
468;Symbiose;Nature Ritual. Create a level 1...8...10 spirit. For each enchantment on a non-spirit creature within range, that creature has +27...125...150 maximum Health. This spirit dies after 30...126...150 seconds.
469;Echos primitifs;Nature Ritual. Create a level 1...8...10 Spirit. For non-Spirit creatures within its range, Signets cost 10 Energy to use. This Spirit dies after 30...126...150 seconds.
470;Saison des prédateurs;Nature Ritual. Create a level 1...8...10 spirit. For non-spirit creatures within its range, all healing is reduced by 20%. If any of your attacks hit, you gain 5 Health. This spirit dies after 30...126...150 seconds.
471;Terre gelée;Nature Ritual. Create a level 1...8...10 spirit. Non-spirit creatures within its range cannot activate resurrection skills. This spirit dies after 30...78...90 seconds.
472;Vents favorables;Nature Ritual. Create a level 1...8...10 spirit.  For non-spirit creatures within its range, arrows move twice as fast and strike for +6 damage.  This spirit dies after 30...126...150 seconds.
474;Vent énergisant;Nature Ritual. Create a level 1...5...6 spirit. For non-spirit creatures within its range, all skills cost 15 less Energy (minimum cost 10 Energy), and skills recharge 25% slower. This spirit dies after 1...25...31 second[s].
475;Zéphyr véloce;Nature Ritual. Create a level 1...8...10 spirit. For non-spirit creatures within its range, all skills recharge twice as fast and cost 30% more of the base Energy to cast. This spirit dies after 15...39...45 seconds.
476;Renouveau de la nature;Nature Ritual. Create a level 1...8...10 spirit. For 30...126...150 seconds, enchantments and hexes cast by non-spirit creatures in range take twice as long to cast, and it costs twice as much Energy to maintain enchantments. This spirit dies after 30...126...150 seconds.
477;Terrain boueux;Nature Ritual. Create a level 1...8...10 spirit. Non-spirit creatures within its range move 10% slower and speed boosts have no effect. This spirit dies after 30...78...90 seconds.
570;Marque d'insécurité;Elite Hex Spell. For 5...21...25 seconds, target foe suffers from -1...3...3 Health degeneration, and enchantments and stances on target foe expire 30...70...80% faster. All of your non-Assassin skills are disabled for 10 seconds.
571;Dague d'interruption;Spell. Send out a Disrupting Dagger at target foe that strikes for 10...30...35 earth damage. If that foe was activating a skill, that skill is interrupted. This spell has half the normal range.
572;Paradoxe mortel;Stance. All of your attack skills are disabled for 10 seconds. For 5...13...15 seconds, your Assassin skills activate and recharge 33% faster.
763;Regard ictérique;Enchantment Spell. Remove an enchantment from target foe. If an enchantment is removed, for the next 1...12...15 second[s], your next enchantment spell casts 0...1...1 second[s] faster and costs 1...8...10 less Energy.
764;Complainte Funeste;Elite Hex Spell. For 1...3...4 second[s], all of target foe's attributes are set to 0.
766;Regard du mépris;Spell. If target foe has more than 50% Health, that foe loses all enchantments.
769;Défense de la vipère;Spell. All adjacent foes are Poisoned for 5...17...20 seconds. Shadow Step to a nearby location directly away from your target.
770;Retour;Spell. All adjacent foes are Crippled for 3...7...8 seconds. Shadow Step to target other ally's location.
771;Aura de déplacement;Elite Enchantment Spell. When you cast Aura of Displacement, Shadow Step to target foe. When you stop maintaining Aura of Displacement you return to your original location.
772;Tsungrai était généreux;Item Spell. Hold Tsungrai's ashes for up to 15...51...60 seconds and gain +50...122...140 maximum Health. When you drop his ashes, you gain 100...244...280 Health.
773;Vorizon était puissant;Item Spell. Hold Vorizun's ashes for up to 15...51...60 seconds. While you hold his ashes, you gain +15 armor and +30 maximum Energy.
775;Efflorescence mortelle;Dual Attack. Must follow an off-hand attack. If it hits, Death Blossom strikes target foe for +20...40...45 damage and all adjacent foes take 20...40...45 damage.
776;Harpon de convulsion;Dual Attack. Must follow an off-hand attack. If it hits, Twisting Fangs strikes for +10...18...20 damage and struck foe suffers from Bleeding and Deep Wound for 5...17...20 seconds.
777;Cornes du boeuf;Dual Attack. Must follow an off-hand attack. If it hits, Horns of the Ox strikes for +1...9...11 damage. If struck foe is not adjacent to any allies, that foe is knocked down.
778;Retombée arachnide;Off-Hand Attack.  Must strike a knocked-down foe. If it hits, Falling Spider strikes for +15...31...35 damage and target foe is Poisoned for 5...17...20 seconds.
