skillId;skillName;skillDescription
0;Vide;Vide
1;Sceau de guérison;Signet. You gain 82...154...172 Health. You have -40 armor while using this skill.
2;Sceau de ressurection;Signet. Resurrect target party member. That party member is returned to life with 100% Health and 25% Energy. This signet only recharges when you gain a morale boost.
3;Sceau de capture;Signet. Choose one skill from a nearby dead Boss of your profession. Signet of Capture is permanently replaced by that skill. If that skill was elite, gain 250 XP for every level you have earned.
5;Blocage de pouvoir;Elite Spell. If target foe is casting a spell or chant, that skill and all skills of the same attribute are disabled for 1...10...12 seconds and that skill is interrupted.
6;Mantra de la Terre;Stance. For 30...78...90 seconds, whenever you take earth damage, the damage is reduced by 26...45...50% and you gain 2 Energy.
7;Mantra de flamme;Stance. For 30...78...90 seconds, whenever you take fire damage, the damage is reduced by 26...45...50% and you gain 2 Energy.
8;Mantra de givre;Stance. For 30...78...90 seconds, whenever you take cold damage, the damage is reduced by 26...45...50% and you gain 2 Energy.
9;Mantra de foudre;Stance. For 30...78...90 seconds, whenever you take lightning damage, the damage is reduced by 26...45...50% and you gain 2 Energy.
10;Leveur de maléfice;Stance. For 5...65...80 seconds, the next time you are the target of a hex, that hex fails and the caster takes 10...39...46 damage.
11;Distorsion;Stance. For 1...4...5 second[s], you have a 75% chance to block attacks.  Whenever you block an attack this way, you lose 2 Energy or Distortion ends.
13;Mantra de récupération;Elite Stance. For 5...17...20 seconds, spells you cast recharge 33% faster.
14;Mantra de persévérance;Stance. For 5...21...25 seconds, any Illusion Magic hex you cast lasts 10...34...40% longer.
15;Mantra des inscriptions;Stance. For 5...21...25 seconds, signets you successfully activate while in this stance recharge 10...34...40% faster.
16;Mantra de concentration;Stance. For 1...31...38 seconds, the next time you would be interrupted, you are not interrupted.
17;Mantra de résolution;Stance. For 30...78...90 seconds, you cannot be interrupted, but each time you would have been interrupted, you lose 10...5...4 Energy or Mantra of Resolve ends.
18;Mantra des sceaux;Stance. For 10...34...40 seconds, you have +3 armor for each signet you have equipped. Whenever you use a signet you gain 5...49...60 health.
19;Fragilité;Hex Spell. For 8...18...20 seconds, target and adjacent foes take 5...17...20 damage each time they suffer or recover from a new condition.
21;Enchantement inspiré;Spell. Removes an enchantment from target foe and gain 3...13...15 Energy. For 20 seconds, Inspired Enchantment is replaced with the enchantment removed from target foe.
22;Maléfice inspiré;Spell. Remove a hex from target ally and gain 4...9...10 Energy. For 20 seconds, Inspired Hex is replaced with the hex that was removed.
23;Dissipation de pouvoir;Spell. If target foe is casting a spell or a chant, that skill is interrupted and target foe takes 30...102...120 damage.
24;Fuite de pouvoir;Spell. If target foe is casting a spell or chant, that skill is interrupted and target foe loses 3...14...17 Energy.
25;Drain de pouvoir;Spell. If target foe is casting a spell or chant, that skill is interrupted and you gain 1...25...31 Energy.
26;Empathie;Hex Spell. For 5...13...15 seconds, whenever target foe attacks, that foe takes 10...46...55 damage and deals 1...12...15 less damage.
27;Dispersion des illusions;Spell. Remove one Mesmer hex from target foe. If a hex was removed, that foe and all adjacent foes takes 15...63...75 damage.
28;Retour de flamme;Hex Spell. For 10 seconds, whenever target foe casts a spell, that foe takes 35...119...140 damage.
29;Black-out;Skill. For 2...5...6 seconds, all of touched target foe's skills are disabled, and all of your skills are disabled for 5 seconds.
30;Diversion;Hex Spell. For 6 seconds, the next time target foe uses a skill, that skill takes an additional 10...47...56 seconds to recharge.
31;Conjuration de fantasme;Hex Spell.  For 2...13...16 seconds, target foe experiences -5 Health degeneration.
32;Illusion de faiblesse;Enchantment Spell. You lose 50...202...240 Health. Illusion of Weakness ends if damage drops your Health below 25% of your maximum. When Illusion of Weakness ends, you gain 50...202...240 Health.
33;Armes illusoires;Elite Enchantment Spell. For 30 seconds, your melee attacks neither hit nor fail to hit. Instead, Illusionary Weaponry deals 8...34...40 damage to your targets for each melee attack. You have +5 armor for each equipped Illusion Magic skill.
34;Visage avenant;Enchantment Spell. For 4...9...10 seconds, whenever target ally is hit by a melee attack, all adjacent foes lose all adrenaline and 3 Energy.
35;Ignorance;Hex Spell. For 8...18...20 seconds target foe cannot use signets.
36;Enigme des Arcanes;Hex Spell. For 5...13...15 seconds, spells cast by target foe and all adjacent foes take twice as long to cast. When this hex ends, you gain 1...6...7 energy. [sic]
37;Illusion de hâte;Enchantment Spell. For 5...10...11 seconds you are no longer Crippled, and you move 33% faster. When Illusion of Haste ends, you become Crippled for 3 seconds.
38;Canalisation;Enchantment Spell. For 8...46...56 seconds, whenever you cast a spell, you gain 1 Energy for each foe in the area.
39;Afflux d'énergie;Elite Spell. Target foe loses 1...8...10 Energy. For each point of Energy lost, that foe and all nearby foes take 9 damage.
40;Festin éthéré;Spell. Target foe loses 3 Energy. You are healed 20...56...65 for each point of Energy lost.
41;Seigneur éthéré;Hex Spell. You lose all Energy. For 5...9...10 seconds, target foe suffers -1...3...3 Energy degeneration, and you experience +1...3...3 Energy regeneration.
42;Flamme d'énergie;Spell. Target foe loses 1...8...10 Energy and takes 9 damage for each point of Energy lost.
43;Maladresse;Hex Spell. For 4 seconds, target and adjacent foes are hexed with Clumsiness. The next time each foe attacks, the attack is interrupted and that foe suffers 10...76...92 damage.
44;Douleur fantôme;Hex Spell. For 10 seconds, target foe suffers -1...3...4 Health degeneration. When Phantom Pain ends, that foe suffers a Deep Wound, lowering that foe's maximum Health by 20% for 5...17...20 seconds.
45;Fardeau éthéré;Hex Spell.  For 10 seconds, target foe moves 50% slower.  When Ethereal Burden ends, you gain 10...16...18 Energy.
46;Culpabilité;Hex Spell. For 6 seconds, the next time target foe casts a spell that targets a foe, the spell fails and you steal up to 5...12...14 Energy from that foe.
47;Incompétence;Elite Hex Spell. For 4 seconds, the next time target foe or any adjacent foe attacks, they take 30...114...135 damage and are Blinded for 10 seconds.
48;Esprit de l'échec;Hex Spell. For 30 seconds, target foe has a 25% chance to miss with attacks. You gain 1...3...3 Energy whenever that foe fails to hit in combat.
49;Délabrement spirituel;Hex Spell. For 5...33...40 seconds, whenever this foe is the target of any of your non-hex Mesmer skills, that foe loses 1 Energy and takes 5...21...25 damage per point of Energy lost. If the target foe's Energy drops to 0, Mind Wrack ends and that foe takes 15...83...100 damage.
50;Embarras de l'incapable;Hex Spell. After 3 seconds, target foe and all adjacent foes take 20...84...100 damage. If that foe successfully uses a skill, Wastrel's Worry ends prematurely and does no damage.
51;Honte;Hex Spell. For 6 seconds, the next time target foe casts a spell that targets an ally, the spell fails and you steal up to 5...12...14 Energy from that foe.
52;Panique;Elite Hex Spell. For 1...8...10 second[s], target foe and all nearby foes are hexed with Panic. When a foe hexed with Panic successfully uses a skill, all other nearby foes are interrupted.
53;Migraine;Elite Hex Spell. For 5...17...20 seconds, target foe suffers -1...7...8 Health degeneration and takes 100% longer to activate skills.
54;Angoisse paralysante;Elite Hex Spell. For 5...17...20 seconds, target moves and attacks 50% slower and suffers -1...7...8 Health degeneration.
55;Rêves enfiévrés;Elite Hex Spell. For 10...22...25 seconds, whenever target foe suffers from a new condition, all foes in the area suffer from that condition as well. If target foe has two or more conditions that foe is Dazed for 1...3...3 second[s].
56;Images apaisantes;Hex Spell. For 8...18...20 seconds, target foe and all adjacent foes cannot gain adrenaline.
57;Cri de Frustration;Spell. If target foe is using a skill, that foe and all foes in the area are interrupted and suffer 15...63...75 damage.
58;Sceau de minuit;Elite Signet. You and target touched foe become Blinded for 15 seconds.
59;Sceau de lassitude;Signet. Target foe and all nearby foes lose 3...7...8 Energy and suffer from Weakness for 1...10...12 second[s].
61;Sceau sangsue;Signet. Interrupt target foe's action. If that action was a spell, you gain 3...13...15 Energy.
62;Sceau d'humilité;Signet. Target foe's elite skill is disabled for 1...13...16 second[s]. Your non-Mesmer skills are disabled for 10 seconds.
63;Sceau de voûte;Elite Signet. All of your signets except Keystone Signet are recharged. For 20 seconds, the next 0...5...6 time[s] you use a signet that targets a foe, all other foes adjacent to your target take 15...51...60 damage and are interrupted.
65;Mimétisme des Arcanes;Spell. For 20 seconds, Arcane Mimicry becomes the non-form elite skill from target other ally.
66;Chaînes spirituelles;Hex Spell. For 5...17...20 seconds, target foe loses 5 Energy whenever that foe attacks.
67;Annihilateur de maléfices;Spell. Remove a hex from target ally. If a hex is removed, foes near that ally take 30...102...120 damage.
68;Drain d'enchantement;Spell. Remove an enchantment from target foe. If an enchantment is removed, you gain 8...15...17 Energy and 40...104...120 Health.
69;Dissipation des enchantements;Spell. Remove an enchantment from target foe. If an enchantment is removed, that foe takes 14...83...100 damage.
72;Résistance aux éléments;Stance. For 30...78...90 seconds, You gain +40 armor against elemental damage, but you lose 24...14...12 armor against physical damage.
73;Résistance physique;Stance. For 30...78...90 seconds, You gain +40 armor against physical damage, but you lose 24...14...12 armor against elemental damage.
74;Echo;Elite Enchantment Spell. For 30 seconds, Echo is replaced with the next skill you use. Echo acts as this skill for 30 seconds.
75;Echo des Arcanes;Enchantment Spell. If you cast a spell in the next 20 seconds, Arcane Echo is replaced with that spell for 20 seconds. Arcane Echo ends prematurely if you use a non-spell skill.
76;Fardeau imaginaire;Hex Spell. For 8...18...20 seconds, target foe moves 50% slower.
77;Tempête chaotique;Spell. Create a Chaos Storm at target foe's location that lasts for 10 seconds. Each second, foes adjacent to this location take 5...21...25 damage and lose 0...2...2 Energy.
78;Epidémie;Spell. Spread all negative conditions and their remaining durations from target foe to all foes adjacent to your target.
79;Drain d'énergie;Elite Spell. Target foe loses 2...8...9 Energy. You gain 3 Energy for each point of Energy lost.
80;Siphon d'énergie;Spell. Target foe loses 4...6...7 Energy. You gain 2 Energy for each point of Energy lost.
81;Vol des Arcanes;Spell. For 5...29...35 seconds, one random spell is disabled for target foe, and Arcane Thievery is replaced by that spell.
82;Mantra de rappel;Elite Enchantment Spell. For 20 seconds, you gain no benefit from it. You gain 10...22...25 Energy when Mantra of Recall ends.
83;Animation d'horreur squelettique;Spell. Exploit nearest corpse to animate a level 1...14...17 bone horror.
84;Animation de démon squelette;Spell. Exploit nearest corpse to animate a level 1...14...17 bone fiend. Bone fiends can attack at range.
85;Animation de serviteurs squelettes;Spell. Exploit nearest corpse to animate two level 0...10...12 bone minions.
86;Equilibre de Grenth;Elite Spell. If target foe has more Health than you, you gain half the difference (up to your maximum Health), and that foe loses an equal amount. If this foe has less Health than you, you lose half the difference, and that foe gains an equal amount.
87;Regard de Verata;Spell. If target hostile animated undead has a master, its bond to its master is broken, making it hostile to all other creatures. If it had no master, you become its master. (50% failure chance with Death Magic 4 or less.)
88;Aura de Verata;Enchantment Spell. All hostile animated undead in the area become bound to you. Verata's Aura ends after 120...264...300 seconds. When Verata's Aura ends, you lose your bond with any undead bound to you. (50% failure chance with Death Magic 4 or less.)
89;Froideur mortelle;Spell. Target foe is struck for 5...41...50 cold damage. If that foe's Health is above 50%, you deal an additional 5...41...50 shadow damage.
90;Sacrifice de Verata;Spell. For 5...9...10 seconds, your undead allies gain +10 Health regeneration. All conditions are removed from those allies and transferred to you. If this spell is successful and you have control of 3 or fewer minions, Verata's Sacrifice instantly recharges.
91;Puits de pouvoir;Elite Well Spell. Exploit nearest corpse to create a Well of Power at that location. For 8...18...20 seconds, allies within the area of Well of Power gain +1...5...6 Health regeneration and +2 Energy regeneration.
92;Puits de sang;Well Spell. Exploit nearest corpse to create a Well of Blood at its location. For 8...18...20 seconds, allies in that area receive +1...5...6 Health regeneration.
93;Puits de douleur;Well Spell. Exploit nearest corpse to create a Well of Suffering at its location. For 10...26...30 seconds, foes in that area suffer -1...5...6 Health degeneration.
94;Puits du profane;Well Spell. Exploit nearest corpse to create a Well of the Profane at its location. For 8...18...20 seconds, foes in that area are stripped of all enchantments and cannot be the target of further enchantments. (50% failure chance with Death Magic 4 or less.)
95;Explosion putride;Spell. The corpse nearest your target explodes, sending out a shockwave that deals 24...101...120 damage to nearby foes.
96;Festin de l'âme;Spell. Exploit nearest corpse to gain 50...234...280 Health.
97;Voyage nécrotique;Spell. Exploit a random corpse. You teleport to that corpse's location and all nearby foes become Poisoned for 5...17...20 seconds.
98;Combustion corporelle;Spell. Exploit a random corpse. You teleport to that corpse's location and gain 25...85...100 Health and 5...17...20 Energy.
99;Lien parasitaire;Hex Spell. For 20 seconds, target foe suffers -1 Health degeneration. The caster is healed for 30...102...120 when Parasitic Bond ends.
100;Ame barbelée;Hex Spell. For 30 seconds, target foe takes 15...27...30 damage when an enchantment or hex is cast on that target.
101;Barbelés;Hex Spell. For 30 seconds, target foe takes 1...12...15 more damage when hit by physical damage.
102;Choc de l'ombre;Spell. Target foe takes 12...41...48 shadow damage. If that foe's Health is above 50%, you steal up to 12...41...48 Health.
103;Prix de l'échec;Hex Spell. For 30 seconds, target foe has a 25% chance to miss with attacks and takes 1...37...46 damage whenever that foe fails to hit in combat.
104;Nova mortelle;Enchantment Spell. For 30 seconds, if target ally dies, all adjacent foes take 26...85...100 damage and are Poisoned for 15 seconds.
105;Essaim mortel;Spell. Deathly Swarm flies out slowly and strikes for 30...78...90 cold damage on up to three targets in the area.
106;Putréfaction;Spell. Target fleshy foe becomes Diseased for 10...22...25 seconds, slowly losing Health.
107;Virulence;Elite Spell. If target foe was already suffering from a condition, that foe suffers from Disease, Poison, and Weakness for 3...13...15 seconds.
108;Souffrance;Hex Spell. For 6...25...30 seconds, target foe and all nearby foes suffer -0...2...3 Health degeneration.
109;Siphon de vie;Hex Spell. For -12...22...24 seconds, target foe suffers -1...3...3 Health degeneration, and you gain +1...3...3 Health regeneration.
110;Festin impie;Spell. Steal up to 10...54...65 Health from up to 1...3...4 foes [sic] in the area.
111;Réveil du sang;Enchantment Spell. For 20...39...44 seconds, you gain +2 Blood Magic and +2 Curses, but whenever you sacrifice Health, you sacrifice 50% more than the normal amount.
112;Désacralisation d'Enchantements;Spell. Target foe and all nearby foes take 6...49...60 shadow damage and 4...17...20 shadow damage for each enchantment on them.
113;Chair putréfiée;Elite Enchantment Spell. For 20...39...44 seconds, target ally is immune to disease, and anyone striking that ally in melee becomes Diseased for 3...13...15 seconds.
114;Aura de la liche;Elite Enchantment Spell. All corpses within earshot are exploited and you animate a level 1...14...17 bone horror plus one for each corpse exploited in this way. For 5...37...45 seconds, your Death Magic attribute is increased by +1.
115;Transfusion sanguine;Enchantment Spell. For 7 seconds, you gain +3...5...6 Health regeneration. When Blood Renewal ends, you gain 40...160...190 Health.
116;Aura noire;Enchantment Spell. For 30 seconds, whenever target ally sacrifices Health, Dark Aura deals 5...41...50 shadow damage to adjacent foes, and you lose 5...17...20 Health.
117;Affaiblissement;Spell. Target suffers from Weakness for 10...26...30 seconds.
118;Sang du faible;Spell. Target foe and all nearby foes suffer from Weakness for 5...17...20 seconds.
119;Pouvoir du sang;Elite Enchantment Spell. For 10 seconds, target other ally gains +3...5...6 Energy regeneration.
120;Sang du Maître;Spell. All of your undead allies are healed for 30...99...116 Health. You sacrifice an additional 2% maximum Health per minion healed in this way.
121;Esprit malveillant;Elite Hex Spell. For 8...18...20 seconds, whenever target foe attacks or uses a skill, Spiteful Spirit deals 5...29...35 shadow damage to that foe and all adjacent allies of that foe.
122;Intervention néfaste;Hex Spell. For 5...17...20 seconds, target foe receives 20% less benefit from healing. If target foe dies while hexed with Malign Intervention, a level 1...14...17 masterless bone horror is summoned.
123;Parasite sournois;Hex Spell. For 5...13...15 seconds, whenever target foe hits with an attack, you steal up to 15...39...45 Health from that foe.
124;Frissons glacés;Hex Spell. For 10...34...40 seconds, whenever target foe is struck for cold damage while using a skill, that foe is interrupted, and you lose 10...6...5 Energy or Spinal Shivers ends.
125;Flétrissure;Elite Hex Spell. For 5...29...35 seconds, target foe suffers -2...4...4 Health degeneration and -1 Energy degeneration. If target foe's Energy reaches 0, that foe takes 15...63...75 damage and Wither ends.
126;Transfert de vie;Elite Hex Spell. For 6...11...12 seconds, target foe and adjacent foes suffer -3...7...8 Health degeneration, which you gain as Health regeneration.
127;Marque de subversion;Hex Spell. For 6 seconds, the next time target foe casts a spell that targets an ally of that foe, the spell fails and you steal up to 10...76...92 Health from that foe.
128;Sangsue de l'âme;Elite Hex Spell. For 10 seconds, whenever target foe casts a spell, you steal up to 16...67...80 Health from that foe.
129;Souillure charnelle;Hex Spell. For 5...29...35 seconds, target foe gains only two-thirds Health from healing.
130;Chair démoniaque;Enchantment Spell. For 30...54...60 seconds, whenever you use a skill that targets a foe, you deal 5...17...20 shadow damage to all other foes adjacent to you.
131;Sceau barbelé;Signet. You inflict Bleeding for 3...13...15 seconds on target foe and all adjacent foes.
132;Sceau du fléau;Elite Signet. Transfer all negative conditions with 100...180...200% of their remaining durations from yourself to target foe. (50% failure chance with Curses 4 or less.)
133;Pacte noir;Spell. Deal 10...40...48 shadow damage to target foe.
134;Ordre de la douleur;Enchantment Spell. For 5 seconds, whenever a party member hits a foe with physical damage, that party member does +3...13...16 damage.
135;Appréhension;Hex Spell. For the next 3...13...16 seconds, target foe attacks 50% slower, and that foe suffers -0...2...3 Health degeneration.
136;Ombre de terreur;Hex Spell. Target foe and all adjacent foes attack 50% slower for the next 5...25...30 seconds.
137;Rigor Mortis;Hex Spell. For 8...18...20 seconds, target foe cannot block.
138;Lien noir;Enchantment Spell. For the next 30...54...60 seconds, whenever you receive damage, your closest minion suffers 75% of that damage for you.
139;Transfert de condition;Enchantment Spell. For the next 15...51...60 seconds, whenever you receive a condition, that condition is transferred to your closest minion instead.
140;Malaise;Hex Spell. For 5...29...35 seconds, target foe suffers -1 Energy degeneration and you suffer -1 Health degeneration. If target foe's Energy reaches 0, that foe takes 5...41...50 damage and Malaise ends.
141;Abolition des enchantements;Spell. Remove 5...8...9 enchantments from target foe. For each Monk enchantment removed, you lose 55...31...25 Health.
142;Malédiction latente;Elite Hex Spell. For 6...25...30 seconds, target foe and all nearby foes suffer -0...2...3 Health degeneration, and gain 20% less benefit from healing.
143;Suppression d'un enchantement;Spell. Remove 0...2...2 enchantment[s] from target foe. If an enchantment is removed, you steal 5...53...65 Health.
144;Engelures;Spell. You become Poisoned for 10 seconds. Foes in the area of your target are struck for 10...37...44 cold damage and lose 1...2...2 enchantment[s].
145;Sceau d'agonie;Signet. You suffer from Bleeding for 25 seconds. All nearby foes take 10...58...70 damage.
146;Offrande de sang;Elite Spell. You gain 8...18...20 Energy.
147;Fureur noire;Enchantment Spell. For 5 seconds, whenever any party member hits with an attack, that party member gains one hit of adrenaline. (50% failure chance with Blood Magic of 4 or less.)
148;Ordre du vampire;Elite Enchantment Spell. For 5 seconds, whenever a party member who is not under the effects of another Necromancer enchantment hits a foe with physical damage, that party member steals up to 3...13...16 Health.
149;Propagation du fléau;Spell. Transfer 1...3...3 negative condition[s] and [its/their] remaining duration[s] from yourself to target foe and all adjacent foes.
150;Marque de douleur;Hex Spell. For 30 seconds, whenever target foe takes physical damage, Mark of Pain deals 10...34...40 shadow damage to adjacent foes.
151;Festin de corruption;Elite Spell. Target foe and all adjacent foes are struck for 16...67...80 shadow damage. You steal up to 8...34...40 Health from each struck foe who is suffering from a hex.
152;Goût de la mort;Spell. Steal up to 100...340...400 Health from target animated undead ally.
153;Regard vampirique;Spell. Steal up to 18...52...60 Health from target foe.
154;Caresse contagieuse;Skill. Transfer 1...3...3 negative condition[s] and [its/their] remaining duration[s] from yourself to target touched foe.
155;Caresse nocive;Skill. Touch target foe to deal 20...56...65 damage.
156;Caresse vampirique;Skill. Touch target foe to steal up to 29...65...74 Health.
157;Rituel de sang;Enchantment Spell. For 8...13...14 seconds, target touched ally gains +3 Energy regeneration. Blood Ritual cannot be used on the caster.
158;Caresse d'agonie;Skill. Target touched foe takes 20...50...58 shadow damage.
159;Armure affaiblie;Spell. Target foe and foes adjacent to your target have Cracked Armor for 5...17...20 seconds.
160;Vitesse du vent;Enchantment Spell. For 5...11...13 seconds, target ally moves 33% faster.
162;Bourrasque;Spell. Knock down target foe for 2 seconds. (50% failure chance with Air Magic 4 or less.)
163;Tornade;Spell. All adjacent foes take 15...63...75 cold damage. Attacking foes struck by Whirlwind are knocked down. If you are Overcast, this spell strikes nearby instead of adjacent.
164;Affinité élémentaire;Elite Enchantment Spell. For 25...53...60 seconds, you are attuned to Air, Fire, Water, and Earth and gain +1...2...2 to these attributes. You gain 50% of the base Energy cost of the skill each time you use magic associated with any of these elements.
165;Armure de la Terre;Enchantment Spell. For 30 seconds, you gain 24...53...60 armor, but move 50...21...14% slower.
166;Armure cinétique;Enchantment Spell. For 8 seconds, you gain +20...68...80 armor. Whenever you cast a spell, Kinetic Armor is renewed for 8 seconds.
167;Eruption;Spell. Cause an Eruption at target foe's location. Each second for 5 seconds, foes near this location are struck for 10...34...40 earth damage and are Blinded for 10 seconds.
168;Aura magnétique;Enchantment Spell. For 1...4...5 second[s], you block the next attack against you and deal 10...42...50 damage to your attacker. If you are Overcast, all party members in earshot are also enchanted.
169;Affinité terrestre;Enchantment Spell. For 36...55...60 seconds, you are attuned to Earth. You gain 1 Energy plus 30% of the base Energy cost of the skill each time you use Earth Magic.
170;Séisme;Spell. You invoke an Earthquake at target foe's location. All foes near this location are knocked down and are struck for 26...85...100 earth damage.
171;Lapidation;Spell. Send out a large stone, striking target foe for 45...93...105 earth damage if it hits. If Stoning hits a foe suffering from Weakness, that foe is knocked down.
172;Dagues de pierre;Spell. Send out two Stone Daggers. Each Stone Dagger strikes target foe for 8...28...33 earth damage if it hits. If you are Overcast, each projectile inflicts Bleeding for 1...4...5 second[s].
