skillId;skillName;skillDescription
1693;Contre-attaque;Melee Attack. If this attack hits, you strike for +5...29...35 damage. If you hit an attacking foe, you gain 2...5...6 Energy.
1694;Frappe du chasseur de mages;Elite Melee Attack. If this attack hits, you strike for +5...17...20 damage. If your target is under the effects of an enchantment, this attack cannot be blocked.
1695;Attaque de soldat;Melee Attack. If this attack hits, you deal +10...34...40 more damage. If you are under the effects of a chant or shout, this attack cannot be blocked.
1696;Décapitation;Elite Axe Attack. You lose all adrenaline and all Energy. If this attack hits, you deal +5...41...50 damage and cause a Deep Wound for 5...17...20 seconds. This attack always results in a critical hit.
1697;Attaque du chasseur de mages;Elite Hammer Attack. If this attack hits, target foe is knocked down. If your target is under the effects of an enchantment, this attack cannot be blocked.
1698;Pose du soldat;Elite Stance. For 5...13...15 seconds, you have a 75% chance to block. You attack 33% faster while under the effects of a shout or chant.
1699;Défense du soldat;Stance. For 1...5...6 second[s], you have a 75% chance to block attacks while under the effects of a shout or chant. You gain 1 strike of adrenaline for each blocked attack.
1700;Défense frénétique;Stance. For 8 seconds, you have a 75% chance to block incoming attacks, but take double damage.
1701;Pose stable;Elite Stance. For 10 seconds, the next time you would be knocked down, you gain 1...3...3 strike[s] of adrenaline and 1...6...7 Energy instead.
1702;Frappe Croc-d'acier;Sword Attack.  If this attack hits, you deal +1...25...31 damage. If you hit a foe that is knocked down, you gain 1...4...5 adrenaline.
1719;Tir hurleur;Bow Attack. If this attack hits, you deal +10...22...25 damage. If your target is within earshot, that foe begins Bleeding for 5...17...20 seconds.
1720;Flèche vive;Bow Attack. If this attack hits, you strike for +5...17...20 damage. If you land a critical hit, you deal an additional +5...21...25 damage.
1721;Férocité unie;Elite Skill. For 3...13...15 seconds, both you and your animal companion attack 33% faster and run 25% faster.
1722;Flèche fourchue;Bow Attack. Shoot two arrows simultaneously at target foe. If you are under the effects of an enchantment or hex, you shoot only one arrow.
1723;Précision perturbatrice;Preparation.  For 36 seconds, whenever your arrows critical, they also interrupt your target.
1724;Dextérité de l'expert;Elite Stance. For 1...16...20 second[s], you attack 33% faster and your Marksmanship attribute is increased by 2.
1725;Vents mugissants;Nature Ritual. Create a level 1...8...10 spirit. Chants and shouts cost 1...4...5 more Energy. This spirit dies after 30...54...60 seconds.
1726;Tir du Fléau des mages;Elite Bow Attack. If this attack hits, it interrupts target foe's action. If that action was a spell, it is disabled for an additional 10 seconds. This attack cannot be blocked.
1727;Foulée naturelle;Stance.  For 1...7...8 second[s], you run 33% faster and have a 50% chance to block incoming attacks. Natural Stride ends if you become hexed or enchanted.
1728;Saccage du Heket;Stance. For 5...10...11 seconds, you attack 33% faster. This stance ends if you use an attack skill.
1729;Piège de fumée;Elite Trap. When Smoke Trap is triggered, nearby foes are Blinded and Dazed for 5...9...10 seconds. Smoke Trap ends after 90 seconds. While activating this skill, you are easily interrupted.
1730;Chaleur exaspérante;Elite Nature Ritual. Create a level 1...8...10 spirit. Non-spirit creatures within its range gain adrenaline twice as fast. This spirit dies after 30...54...60 seconds.
1731;Sogolon était énergétique;Item Spell. For 60 seconds, all shouts and chants you use last 20...44...50% longer.
1732;Glaive était destructrice;Elite Item Spell. Hold Glaive's ashes for up to 30...54...60 seconds. While you hold her ashes, all Ritualist skills have 20% armor penetration. When you drop her ashes, all foes in the area are struck for 15...71...85 lightning damage.
1733;Attaque du porteur;Spell. Target foe is struck for 5...41...50 lightning damage. If you are under the effects of a weapon spell, you deal an additional 10...34...40 lightning damage.
1734;Regard de fureur;Binding Ritual. Destroy target spirit and create a level 1...11...14 Spirit of Fury. This spirit's attacks deal 5...17...20 damage. This spirit dies after 30...54...60 seconds.
1736;Force de l'esprit;Elite Enchantment Spell. For 15...51...60 seconds, your attacks deal 5...29...35 more damage while under the effects of a weapon spell.
1737;Zèle du porteur;Elite Enchantment Spell. For 10...26...30 seconds, whenever you cast a Weapon Spell on an ally, you gain 1...4...5 Energy.
1738;Vision intérieure;Enchantment Spell. For 8...18...20 seconds, you cannot be Blinded.
1739;Souvenirs renouvelés;Enchantment Spell. For 5...17...20 seconds, while holding an item, any weapon and item Spells you cast cost 5...29...35% less Energy.
1740;Remède du porteur;Enchantment Spell. For 10...26...30 seconds, whenever you cast a weapon spell on an ally, that ally loses 1 condition.
1741;Lumière du miroir fantôme;Spell. Target other ally is healed for 15...75...90 Health. If you are within earshot of a spirit, you are also healed for 15...75...90 Health.
1742;Sceau de puissance spectrale;Elite Signet. For 5...17...20 seconds, all spirits you control within earshot attack 33% faster and deal 5...9...10 additional damage.
1743;Sceau d'asservissement;Signet. You lose 200...80...50 Health and take control of target enemy-controlled spirit. (50% failure chance with Spawning Power 4 or less.)
1744;Charge du gardien;Elite Spell. Target foe is struck for 20...64...75 lightning damage. If you are holding an item, you gain 5 Energy and 5...41...50 Health.
1745;Angoisse;Binding Ritual. Create a level 1...9...11 spirit. This spirit's attacks deal 5...17...20 damage and deal double damage to hexed foes. This spirit dies after 15...39...45 seconds.
1747;Responsabilisation;Binding Ritual. Create a level 1...11...14 spirit. All allies within its range holding an item gain 15...39...45 maximum Health and 10 maximum Energy. This spirit dies after 15...51...60 seconds.
1748;Récupération;Binding Ritual. Create a level 1...11...14 spirit. Conditions on allies within range of this spirit expire 20...44...50% faster. This spirit dies after 30...54...60 seconds.
1749;Arme de furie;Elite Weapon Spell. For 5...17...20 seconds, target ally gains 5...41...50% more adrenaline and 1 Energy whenever that ally successfully hits with an attack.
1750;Arme de Xinrae;Elite Weapon Spell. For 8 seconds, the next time target ally takes damage from a foe that damage is limited to 5% of that ally's max Health and that ally steals up to 20...68...80 Health from that foe.
1751;Arme du belliciste;Weapon Spell. For 3...11...13 seconds, if target ally attacks a foe who is not attacking, that foe is interrupted.
1752;Arme de remède;Elite Weapon Spell. For 8 seconds, the next time target ally takes damage or life steal from a foe, that ally steals up to 15...63...75 Health from that foe and loses 1 condition.
1753;Frappe déchirante;Scythe Attack. You deal +5...17...20 and lose 1 Dervish enchantment. If an enchantment was lost, you remove an enchantment from each foe you hit.
1754;Attaque;Elite Flash Enchantment Spell. For 3...13...15 seconds, you attack, move and gain adrenaline 25% faster.
1755;Corruption mystique;Flash Enchantment Spell. All adjacent foes suffer from Disease for 1...2...2 second[s]. For 20 seconds, nothing happens. Disease duration is doubled if you are enchanted when you activate this skill. When this enchantment ends, all party members in earshot are cured of Disease.
1756;Empoigne de Grenth;Elite Flash Enchantment Spell. For 20 seconds, if you are wielding a cold weapon, your attack skills also Cripple that [sic] foe for 1...9...11 second[s] and you transfer 1 condition from yourself to that foe.
1757;Voile d'épines;Flash Enchantment Spell. When you cast this enchantment, all nearby foes are struck for 5...41...50 piercing damage. For 5...21...25 seconds you take 5...29...35% less damage from spells.
1758;Empoigne d'harrier;Flash Enchantment Spell. For 5...17...20 seconds, attacks against moving foes also Cripple that foe for 2...8...9 seconds. This enchantment ends after you apply Cripple 1...3...3 times. [sic] When you cast this spell, you lose Cripple and 1 other condition.
1759;Voeu de force;Elite Enchantment Spell. For 15 seconds, whenever you attack a foe with your scythe, you deal 10...22...25 slashing damage to all adjacent foes.
1760;Aura de poussière d'ébène;Elite Flash Enchantment Spell. When you cast this enchantment, all nearby foes are Blinded for 1...6...7 second[s]. For 30 seconds, if you are wielding an earth weapon, your melee attacks deal +3...13...15 earth damage. When this enchantment ends, you are cured of Blindness.
1761;Voeu zélé;Elite Enchantment Spell. For 20 seconds, you have -3 Energy regeneration, and you gain 1...5...6 Energy every time you hit with an attack.
1762;Coeur de furie;Stance.  For 2...8...10 seconds, you attack 25% faster.
1763;Renouveau zélé;Flash Enchantment Spell. All nearby foes take 5...25...30 holy damage. For 5...21...25 seconds, you have -1 Energy regeneration, and gain 1 Energy whenever you hit a foe. If this enchantment ends prematurely, you gain 1...4...5 Energy.
1764;Clairvoyance de l'attaquant;Flash Enchantment Spell. For 3...9...10 seconds you have a 50% chance to block while attacking. When this enchantment ends, you inflict Weakness on all adjacent foes for 3...13...15 seconds.
1765;Aura déchirante;Flash Enchantment Spell. When you cast this enchantment, all nearby foes take 10...34...40 cold damage. For  30 [sic] seconds, your attack skills remove enchantments from knocked-down foes. When this enchantment ends, nearby foes are affected by Cracked Armor for 1...8...10 second[s].
1766;Grâce de Pied-de-plume;Enchantment Spell. For 5...17...20 seconds, you move 25% faster, and conditions expire 25% faster.
1767;Frappe du moissonneur;Elite Scythe Attack. If this attack hits, you Cripple your target for 3...13...15 seconds. You lose 1 Dervish enchantment. If an enchantment was removed, this attack knocks down for 2...3...3 seconds.
1768;Hâte d'harrier;Flash Enchantment Spell. For 2...7...8 seconds, you move 25% faster and deal +3...10...12 more damage against moving foes.
1769;Colère concentrée;Elite Skill. For 45 seconds, you gain 0...120...150% more adrenaline.
1770;Tempérament naturel;Skill. For 4...9...10 seconds, you gain 33% more adrenaline while not under the effects of an Enchantment.
1771;Chant de rétablissement;Elite Chant. For 10 seconds, the next time each party member within earshot uses a skill, that party member gains 45...97...110 Health.
1772;Poème de purification;Chant. For 5...17...20 seconds, the next time each ally within earshot uses a Signet, that ally loses 1 Condition.
1773;Fureur du soldat;Elite Echo. For 10...30...35 seconds, if you are under the effects of a chant or a shout, you attack 33% faster and gain 33% more adrenaline, but you have -20 armor.
1774;Refrain agressif;Echo. For 5...21...25 seconds, you attack 25% faster but have -20 armor. This echo is reapplied every time a chant or shout ends on you.
1775;Finale énergisant;Echo. For 10...30...35 seconds, whenever a shout or chant ends on target non-spirit ally, that ally gains 1 Energy.
1776;Sceau d'agression;Signet. If you are under the effects of a shout or chant, you gain 2 strikes of adrenaline.
1777;Sceau du remède;Signet. You lose 1 condition.
1778;Sceau de retour;Signet. Resurrect target party member with 5...13...15% Health and 1...3...4% Energy for each party member within earshot.
1779;"Profitez de votre temps !";Shout. You gain 1 strike of adrenaline for each party member within earshot (maximum 1...4...5 adrenaline).
1780;"Touche pas !";Shout. For 20 seconds, the next 1...4...5 touch skill[s] used against allies [sic] within earshot fail[s].
1781;"Trouvez leur faiblesse !";Shout. For 5...17...20 seconds, the next time target ally attacks, that ally deals +5...41...50 damage and inflicts a Deep Wound for 5...17...20 seconds.
1782;"La force est avec vous !";Elite Shout. For 3 seconds, all allies within earshot gain 0...1...1 Energy regeneration.
1783;Javelot de l'assassin;Spear Attack. If this attack hits, you deal +5...21...25 damage. If that foe has more Health than you, that foe suffers from a Deep Wound for 5...17...20 seconds.
1784;Javeline leste;Spear Attack. If this attack hits, you deal +5...17...20 damage. If you are under the effects of an enchantment, this spear flies twice as fast and cannot be blocked.
1814;Regard du Porteur de lumière;Skill. Target demonic servant of Abaddon takes 100 holy damage and is interrupted. This skill strikes one additional foe in the area for each rank of Lightbringer you have attained. This skill is disabled for 15 seconds after it is used.
1815;Sceau du Porteur de lumière;Signet. If you are within the area of a demonic servant of Abaddon, you gain 4...5 strikes of adrenaline and 22...24 Energy.
1816;Sceau de Renaissance du Lancier du Soleil;Signet. Resurrect target dead party member at your location with full Health and 10% Energy for each Sunspear rank you have attained. This signet can only be used once per mission unless recharged by a morale boost.
1986;Assaut vampirique;Dual Attack. Must follow an off-hand attack. If this attack hits, you steal 10...34...40 Health.
1987;Coup du lotus;Off-Hand Attack. Must follow a lead attack. If it hits, this attack strikes for +10...22...25 damage and you gain 5...17...20 Energy.
1988;Attaque des crocs dorés;Off-Hand Attack. Must follow a lead attack. If you are under the effects of an enchantment and this attack hits, target foe suffers from a Deep Wound for 5...17...20 seconds.
1990;Coup du lotus tombant;Off-Hand Attack. Must strike a knocked-down foe. If it hits, you strike for +15...31...35 damage and gain 1...10...12 Energy.
1991;Sceau sadique;Signet. You gain 10...34...40 Health for each condition on target foe.
1992;Sceau de distraction;Signet. If target foe is casting a spell, that spell is interrupted and disabled for 1...4...5 seconds for each signet you have equipped.
1993;Sceau de Rappel;Signet. For 10 seconds, you have -4 Energy regeneration. When this effect ends, you gain 13...19...20 Energy.
1994;Verrouillage de pouvoir;Spell. If target foe is casting a spell or chant, that skill is interrupted and disabled for an additional 5...11...13 seconds.
1995;Pas de petites économies;Spell. If target foe is not casting a spell or attacking, you gain 8...12...13 Energy.
1996;La somme de toutes les peurs;Hex Spell. For 1...8...10 second[s], target foe moves, attacks, and casts spells 33% slower.
1997;Aura de Flétrissure;Enchantment Spell. For 5...17...20 seconds, target ally's melee attacks cause Weakness for 5...17...20 seconds.
1998;Cacophonie;Hex Spell. For 10 seconds, whenever target foe uses a shout or chant, that foe takes 35...91...105 damage.
1999;Etreinte de l'hiver;Hex Spell. For 2...5...6 seconds, target foe moves 66% slower and takes 5...13...15 damage while moving.
2000;Chaînes de terre;Hex Spell. For 3 seconds, target and all nearby foes move 90% slower. When Earthen Shackles ends, it applies Weakness for 5...17...20 seconds.
2001;Protection de faiblesse;Ward Spell. You create a Ward of Weakness at your current location. For 5...17...20 seconds, foes in this area become Weakened for 5...17...20 seconds whenever they take elemental damage.
2002;Glyphe de rapidité;Glyph. For 15 seconds, your next 1...4...5 spell[s] recharge 25% faster and projectiles from the affected spells move 200% faster.
2003;Guérison de maléfice;Spell. Remove one Hex from target ally. If a Hex was removed, that ally is healed for 30...102...120 Health.
2004;Expiation des conditions;Spell. Remove one condition from target ally. If a condition was removed, foes in the area take 10...50...60 holy damage.
2005;Compagnon du châtiment;Enchantment Spell. For 30 seconds, your Smiting Prayers have double the Divine Favor bonus.
2006;Sceau de pénitence;Signet. Target foe takes 26...50...56 holy damage. If that foe was attacking, you gain 1...8...10 Energy.
2007;Voile purifiant;Enchantment Spell. While you maintain this enchantment, conditions expire 5...41...50% faster on target ally. When this enchantment ends, one condition is removed from that ally.
2008;Collision pulvérisante;Hammer Attack. If you hit a knocked-down foe, that foe suffers from Weakness and a Deep Wound for 5...17...20 seconds.
2009;Coup enthousiaste;Axe Attack. If it hits, this attack always results in a critical hit.
2010;Coupe-genou;Sword Attack. If this attack hits a Crippled foe, you gain 2...6...7 Energy and 1...3...3 strikes [sic] of adrenaline.
2011;Grappin;Skill. You and target touched foe are knocked down. You lose your current stance.
2012;Faux rayonnante;Scythe Attack. This attack strikes for +1 damage for each point of Energy you currently have, maximum 5...25...30. You gain 1...6...7 Energy if this attack hits.
2013;Aura de Grenth;Flash Enchantment Spell. For 20 seconds, you deal 5...21...25 less damage and steal 5...21...25 Health whenever you hit with a scythe attack. When you cast this enchantment you steal 5...21...25 Health from all adjacent foes.
2014;Sceau de contrainte pieuse;Signet. Remove one Dervish enchantment. Target foe is Crippled for 5...13...15 seconds. If an enchantment was removed, all foes nearby your target are also Crippled and this signet recharges 75% faster.
2015;Faux du fermier;Scythe Attack. If this attack hits, you deal +5...17...20 damage. If you hit more than one foe, this attack recharges instantly.
2016;Lee Sa était énérgétique;Item Spell. Hold Lee Sa's ashes for 5...13...15 seconds. While you hold her ashes, you gain +2 Energy regeneration. When you drop her ashes, you gain +1...8...10 Energy.
2017;Hymne de lassitude;Chant. For 8 seconds, the next attack skill used by each ally within earshot also causes Weakness for 1...13...16 second[s].
2018;Hymne d'interruption;Chant. For 1...8...10 seconds, the next attack skill used by each ally within earshot also interrupts an action.
2052;Crocs de l'ombre;Hex Spell. Shadow Step to target foe. For 10 seconds, this hex does nothing. When this hex ends, you return to your original location and that foe suffers from a Deep Wound for 5...17...20 seconds.
2053;Risque calculé;Hex Spell. For 3...20...24 seconds, target foe's attacks do +10 damage, but there is a 50% chance that the damage from each attack will be done to that foe instead. (Maximum 15...83...100 damage.)
2054;Rétraction d'armure;Hex Spell. For 10 seconds, target foe suffers from -1...3...4 Health degeneration. When this hex ends, that foe has Cracked Armor for 5...17...20 seconds.
2055;Anévrisme;Spell. Target foe regains all Energy. For each point of Energy gained in this way, that foe takes 1...3...3 damage and all adjacent foes lose 1 Energy. (Maximum 1...24...30).
2056;Oeil errant;Hex Spell. For 4 seconds, the next time target foe attacks, that attack is interrupted and all nearby foes take 30...94...110 damage.
2057;Festin immonde;Spell. All conditions are transferred from target other ally to yourself. For each condition acquired in this way, you gain 0...36...45 Health and 0...2...2 Energy. This skill recharges twice as fast if you remove Disease from your target.
2058;Fiel putrice;Hex Spell. For 5...17...20 seconds, target foe suffers -1...3...3 Health degeneration. If that foe dies while under the effects of this hex, all nearby foes take 25...73...85 damage.
2059;Traumatisme;Spell. Target foe is struck for 10...26...30 lightning damage and has Cracked Armor for 5...17...20 seconds. This spell has 25% armor penetration. If you are Overcast, this spell strikes adjacent foes.
2060;Glyphe d'immolation;Glyph. For 15 seconds, your next 1...3...4 spell[s] that target[s] a foe also cause[s] Burning for 1...3...4 second[s].
2061;Esprit patient;Enchantment Spell. For 2 seconds, target ally is enchanted with Patient Spirit. Unless this enchantment ends prematurely, that ally is healed for 30...102...120 Health when the enchantment ends.
2062;Ruban de guérison;Spell. Target other ally is healed for 20...92...110 Health. Up to 2 additional allies near target ally are healed for 10...82...100 Health.
2063;Ame inébranlable;Enchantment Spell. For 3...7...8 seconds, target other ally cannot be knocked down.
2064;Esprit impéccable;Enchantment Spell. For 1...12...15 seconds, target other ally loses a hex every 5 seconds.
2065;Ame impeccable;Enchantment Spell. For 1...12...15 seconds, target other ally loses a condition every 3 seconds.
2066;Désarmement;Sword Attack. Interrupt target foe's action.  If that action was an attack, all of that foe's attack skills are disabled for 0...2...3 second[s].
2067;"C'est ce que je comptais faire !";Shout. If you are knocked down, you gain 1...4...5 strikes of adrenaline.
2068;Feu rapide;Preparation. For 5...21...25 seconds, you attack 33% faster while wielding a bow.
2069;Tir du chasseur paresseux;Bow Attack. If this attack hits, target foe takes +10...22...25 damage. If that foe is not using a skill, Sloth Hunter's Shot does an additional +10...30...35 damage.
2070;Trancheur d'aura;Melee Attack. If this attack hits, you inflict Bleeding for 5...13...15 seconds. If you are enchanted, you also inflict Cracked Armor for 1...8...10 second[s].
2071;Frappe zélée;Scythe Attack. If this attack hits, you deal +5...17...20 damage. You gain 3 Energy and 1 adrenaline for each foe you hit.
2072;Li Ming était pure;Item Spell. Hold Li Ming's ashes for 5...17...20 seconds. While you hold her ashes, conditions on you expire 10...42...50% faster. When you drop her ashes, all allies within earshot lose 1...3...4 condition[s].
2073;Arme d'agression;Weapon Spell. For 5...13...15 seconds, you attack 25% faster.
2074;Cogne poitrine;Spear Attack. If this attack hits a foe with Cracked Armor, that foe suffers a Deep Wound for 5...17...20 seconds.
2075;Refrain rapide;Echo. For 3...9...11 seconds, target ally moves 25% faster. This echo is reapplied every time a chant or shout ends on that ally.
2101;Agilité critique;Enchantment Spell. For 4 seconds and 1 second for each rank of Critical Strikes, you attack 33% faster and gain 15...25 armor. This skill reapplies itself every time you land a critical hit.
2102;Cri de douleur;Spell. Interrupt target foe's skill. If that foe was suffering from a Mesmer hex, that foe and all foes in the area take 25...50 damage and have 3...5 Health degeneration for 10 seconds.
2103;Nécrose;Skill. If target foe is suffering from a condition or hex, that foe suffers 60...90 damage.
2104;Intensité;Skill. For 10 seconds, the next time you deal elemental damage with a spell to a target, you deal 60...70% of that damage to all other foes in the area.
2105;Graine de vie;Enchantment Spell. For 2...5 seconds, whenever target other ally takes damage, all party members are healed for 2 Health for each rank in Divine Favor.
2107;Attaque tourbillon;Melee Attack. Attack target and adjacent foes. Each attack that hits deals +13...20 damage.
2108;Saccage collectif;Skill. For 18...25 seconds, you and your pet attack 25% faster and have 1...3 Health regeneration.
2109;Aura éternelle;Enchantment Spell. You have +100 max Health. When this enchantment ends, all party members in the area are resurrected with 40...50% Health and 20...30% Energy.
2110;Vampirisme;Binding Ritual. Create a level 4...14 spirit that dies after 75...150 seconds. Attacks by this spirit steal up to 10...20 Health, and you are healed for 10...20 Health.
2112;"Il n'y a rien à craindre !";Shout. For 4 seconds and 1 second for every 2 ranks in Leadership, all party members within earshot take 20...35% less damage. Affected party members are healed for 35...60 Health when this shout ends.
2116;Attaque sournoise;Melee Attack. If this attack hits, target foe is Blinded for 5...8 seconds. This attack counts as a lead attack.
2135;Piétinement du boeuf;Dual Attack. Must follow an off-hand attack. If it hits, you deal +5...17...20 damage. If you a [sic] hit a Crippled foe, that foe is knocked down.
2136;Defense poudre fumigène;Stance. For 8 seconds, the next time you are struck, you take half damage and all adjacent foes are Blinded for 2...5...6 seconds.
2137;Images déroutantes;Hex Spell. For 2...8...10 seconds, target foe takes twice as long to activate non-attack skills.
2138;Vigeur du lanceur de maléfice;Enchantment Spell. For 10 seconds, you have +1...7...8 Health regeneration. Hexer's Vigor ends if you cast a non-hex skill.
2139;Masochisme;Enchantment Spell. For 10...34...40 seconds, you have +2 to your Death Magic and Soul Reaping attributes and sacrifice 5...3...3% of your maximum Health when you cast a spell.
2140;Piège perforant;Trap. When Piercing Trap is triggered, all nearby foes are struck for 5...41...50 piercing damage. Any foes with Cracked Armor are struck for an additional 15...51...60 damage. Piercing Trap ends after 90 seconds. While activating this skill, you are easily interrupted.
2141;Camaraderie;Skill. If you have less Health than your pet, you are healed for 30...102...120 Health. If your pet has less Health than you, it is healed for 30...102...120 Health.
2142;Agression barbare;Skill. For 5...17...20 seconds, your pet attacks 33% faster and deals +3...9...10 additional damage.
2143;Tir d'interruption;Bow Attack. If this attack hits, target foe's action is interrupted. If that action was a Skill, you strike for +10...34...40 damage.
