skillId;skillName;skillDescription
949;Méthode du renard;Enchantment Spell.  For 10...30...35 seconds, your next 1...5...6 attack[s] cannot be blocked.
950;Fardeau nébuleux;Hex Spell.  For 3...13...15 seconds, target foe moves 25% slower and while target foe has no other hexes, that foe has 20 less armor against your attacks.
951;Siphon de vitesse;Hex Spell. For 5...13...15 seconds, target foe moves 33% slower and you move 33% faster. This spell has half the normal range. This spell recharges 50% faster if cast on a moving foe.
952;Charge mortelle;Spell. Shadow Step to target foe. If that foe has more Health than you, you are healed for 65...173...200.
953;Flux de puissance;Elite Hex Spell. If target foe is casting a spell or chant, that skill is interrupted and for 4...9...10 seconds, that foe has -2 Energy degeneration.
954;Expulsion de maléfices;Elite Spell. Remove up to 2 Hexes from target ally.
955;Confiscation d'enchantement;Spell. Remove 1 enchantment from target foe. If an enchantment was removed, that foe suffers from Bleeding for 5...21...25 seconds.
957;Bouclier contre les sorts;Enchantment Spell. For 5...17...20 seconds, while you are casting spells, foes cannot target you with spells. When Spell Shield ends, all your skills are disabled for 10...6...5 seconds.
958;Souffle réparateur;Spell. Target other ally is healed for 40...88...100. This spell has half the normal range.
959;Lumière éthérée;Spell. Target ally is healed for 25...85...100. This spell is easily interrupted.
960;Libération d'enchantements;Spell. Lose all enchantments. Each party member is healed for 5...29...35 Health for each Monk enchantment lost.
961;Lacération;Elite Nature Ritual. Create a level 1...8...10 spirit. Bleeding creatures within its range suffer -2 Health degeneration. When this spirit dies, all non-spirit creatures within its range that have less than 90% Health begin Bleeding for 5...21...25 seconds. This spirit dies after 30...126...150 seconds.
962;Transfert d'esprit;Spell. The spirit nearest you loses 5...41...50 Health. Target ally is healed for 5 for each point of Health lost.
963;Restauration;Binding Ritual. Create a level 1...11...14 spirit. When this spirit dies, all party members in the area are resurrected with 5...41...50% Health and zero Energy. This spirit dies after 30 seconds.
964;Arme de vengeance;Weapon Spell. For 8 seconds, the next time target ally takes damage or life steal from a foe, that ally steals up to 15...51...60 Health from that foe.
973;Poudre aveuglante;Spell. Must follow an off-hand attack. Target foe and all adjacent foes become Blinded for 3...13...15 seconds.
974;Toucher de la mante;Spell. Must follow a lead attack. Target foe becomes Crippled for 5...17...20 seconds. This skill counts as an off-hand attack.
975;Assaut épuisant;Dual Attack. Must follow a lead attack. Target foe's action is interrupted. If that action was casting a spell, target foe suffers 10 Overcast.
976;Coup répété;Off-Hand Attack. Must follow an off-hand attack. If it hits, this attack strikes for +10...26...30 damage. If it misses, it takes an additional 15 seconds to recharge.
977;Méthode du lotus;Enchantment Spell.  For 20 seconds, the next time you hit with a dual attack skill, you gain 5...17...20 Energy.
978;Marque d'instabilité;Hex Spell. For 20 seconds, the next time you hit target foe with a dual attack skill that foe is knocked down.
979;Défiance;Hex Spell. For 6 seconds, the next spell that target foe casts on one of your allies fails and deals 10...82...100 damage to that foe and all nearby foes.
980;Festin de l'esprit;Spell. Destroy all nearby allies' spirits. For each spirit destroyed in this way, all party members are healed for 50...90...100 Health.
981;Rétablissement;Binding Ritual. Create a level 1...11...14 spirit. Non-spirit allies within its range gain +1...3...3 Health regeneration. This spirit dies after 15...39...45 seconds.
982;Refuge;Binding Ritual. Create a level 1...10...12 spirit. Non-spirit allies within its range cannot lose more than 10% maximum Health from a single attack. When this spirit prevents damage, it loses 75...51...45 Health. This spirit lasts 30...54...60 seconds.
983;Arme de l'Ombre;Weapon Spell. For 1...6...7 second[s], target ally has a Weapon of Shadow. Whenever that ally is struck by an attack, that ally's attacker becomes Blinded for 5 seconds. The next 1...3...3 times [sic] that ally hits with an attack, his target is Blinded for 5 seconds.
985;Chausse-trappes;Spell. Target foe and all foes adjacent to your target are Crippled for 5...13...15 seconds. Caltrops has half the normal range.
986;Coup des neuf queues;Dual Attack. Must follow an off-hand attack. Nine Tail Strike cannot be blocked and strikes for +15...35...40 damage if it hits.
987;Méthode de la paume vide;Elite Enchantment Spell. For 5...17...20 seconds, off-hand and dual attacks cost no Energy.
988;Frappe à la tempe;Elite Off-Hand Attack. Must follow a lead attack. If this attack hits, target foe is Dazed and Blinded for 1...8...10 seconds, and if target foe is casting a spell, that foe is interrupted.
989;Coup du phénix doré;Off-Hand Attack. If you are not under the effects of an enchantment, this skill misses. If it hits, Golden Phoenix Strike deals +10...26...30 damage and all adjacent foes take 10...26...30 damage.
990;Censure d'Enchantements;Skill. Target foe loses 1 enchantment. All of your other non-attack skills are disabled for 10...6...5 seconds. For each skill disabled in this way, target touched foe loses 1 additional enchantment.
991;Négation de maléfices;Spell. Remove one hex from target ally and one additional hex for each recharging Divine Favor skill you have.
992;Triple coup;Elite Axe Attack. Attack target foe and adjacent foes. Each attack that hits deals +10...34...40 damage.
993;Coup enragé;Elite Hammer Attack. If Enraged Smash hits, you gain 1...3...4 strike[s] of adrenaline. If you hit a moving foe, you strike for +10...34...40 damage, and target foe is knocked down.
994;Coup de renouvellement;Hammer Attack.  If Renewing Smash hits, it deals +10...34...40 damage.  If you hit a knocked-down foe, you gain 3 Energy and this attack recharges instantly.
995;Pose du tigre;Stance.  For 4...9...10 seconds, you attack 33% faster. Tiger Stance ends if any of your attacks fail to hit.
996;Entaille permanente;Sword Attack. If it hits, Standing Slash deals +5...17...20 damage plus an additional 5...17...20 damage if you are in a stance.
997;Famine;Elite Nature Ritual. Create a level 1...8...10 spirit. Whenever a non-spirit creature in its range reaches 0 Energy, that creature takes 10...30...35 damage. This spirit dies after 30...78...90 seconds.
1014;"Let's Get 'Em!";Shout. For 5 seconds, all allies within earshot move 10% faster. You gain 1 strike of adrenaline for each ally affected.
1018;Oeil critique;Skill. For 10...30...35 seconds, you have an additional 3...13...15% chance to land a critical hit when attacking. You gain 1 Energy whenever you score a critical hit.
1019;Attaque critique;Dual Attack. Must follow an off-hand attack. If it hits, this attack strikes for +10...26...30 damage, results in a critical hit, and you gain 1...3...3 Energy.
1020;Lames d'acier;Dual Attack. Must follow an off-hand attack. If it hits, this attack strikes for +5...14...16 damage (maximum bonus 60) for each recharging dagger attack.
1021;Frappe de la jungle;Off-Hand Attack. Must follow a lead attack. If it hits, this attack strikes for +10...22...25 damage. If it hits a foe that was Crippled, that foe and all adjacent foes take +1...25...31 damage.
1022;Affront sauvage;Off-Hand Attack. Must follow a lead attack. If it hits, this attack strikes for +10...30...35 damage and any stance being used by target foe ends. This attack cannot be blocked.
1023;Piqûre de mante sauteuse;Lead Attack. If Mantis Sting hits, target foe takes +5...13...15 damage. If this attack strikes a moving foe, that foe is Crippled for 3...13...15 seconds.
1024;Attaque de la mante noire;Lead Attack. If this attack hits, you strike for +8...18...20 damage. If target foe is suffering from a Hex, that foe is Crippled for 3...13...15 seconds.
1025;Blessure d'interruption;Lead Attack. If this attack hits, it interrupts target foe's action. If that action was a spell, it is disabled for 3...9...10 seconds.
1026;Coup du lotus doré;Lead Attack. If it hits, this attack strikes for +5...17...20 damage. If you are under the effects of an Enchantment, you gain 5...7...8 Energy.
1027;Défenses critiques;Enchantment Spell. For 4...9...10 seconds, you have a 75% chance to block. Critical Defenses refreshes every time you land a critical hit.
1028;Méthode du geste parfait;Enchantment Spell.  For 60 seconds, whenever you successfully land a critical hit, you gain 10...34...40 Health.
1029;Apostasie obscure;Elite Enchantment Spell. For 3...14...17 seconds, every time you successfully land a critical hit, you remove one enchantment from your target. If you remove an enchantment in this way, you lose 10...5...4 Energy or Dark Apostasy ends.
1030;Fureur de Locuste;Elite Enchantment Spell. For 10...30...35 seconds, you have an additional 50% chance to double strike while using daggers.
1031;Linceul de détresse;Enchantment Spell.  For 30...54...60 seconds, if you are below 50% Health, you have 3...7...8 health regeneration and a 75% chance to block attacks.
1032;Coeur d'ombre;Spell. You are healed for 30...126...150. Shadow Step to a nearby location directly away from your target.
1033;Empalement;Skill. Must follow a dual attack. Target foe is struck for 25...85...100 earth damage and suffers from a Deep Wound for 5...17...20 seconds.
1034;Plaie suintante;Elite Hex Spell. For 1...6...7 second[s], target foe moves 33% slower. That foe takes 5...21...25 damage each second while suffering from a condition. This spell has half the normal range.
1035;Promesse de l'Assassin;Elite Hex Spell. For 5...13...15 seconds, if target foe dies, you gain 5...17...20 Energy and all your skills are recharged.
1036;Sceau de malice;Signet. For each condition suffered by target foe, you lose one condition.
1037;Echappatoire obscure;Stance. For 5...13...15 seconds, you move 25% faster and take half damage. Dark Escape ends if you successfully hit with an attack.
1038;Dague d'Infirmité;Spell. Send out a Crippling Dagger at target foe. Crippling Dagger strikes for 15...51...60 earth damage if it hits, and Cripples moving foes for 3...13...15 seconds. This spell has half the normal range.
1040;Marche des esprits;Spell. Shadow Step to target spirit.
1041;Furie invisible;Stance. All adjacent foes are Blinded for 3...9...10 seconds. For 10...26...30 seconds, you cannot be blocked by Blinded foes.
1042;Lames éclatantes;Elite Stance. For 5...25...30 seconds, you have a 75% chance to block incoming attacks while attacking. If you block an attack in this way, your attacker takes 5...17...20 damage.
1043;Ruée;Stance. For 3 seconds, you run 50% faster.
1044;Prison obscure;Hex Spell. Shadow Step to target foe. For 1...5...6 seconds, that foe moves 33% slower.
1045;Coup de paume;Elite Skill. Target touched foe takes 10...54...65 damage and is Crippled for 1...4...5 second[s]. This skill counts as an off-hand attack.
1048;Enchantement révélé;Spell. Remove an enchantment from target foe and gain 3...13...15 Energy. For 20 seconds, Revealed Enchantment is replaced with the enchantment removed from target foe.
1049;Maléfice révélé;Spell. Remove a hex from target ally and gain 4...9...10 Energy. For 20 seconds, Revealed Hex is replaced with the hex that was removed.
1052;Cumul de douleur;Spell. Target foe takes  15...63...75 damage. If target foe is suffering from 2 or more hexes, that foe suffers a Deep Wound for 5...17...20 seconds.
1053;Distraction psychique;Elite Spell. All of your other skills are disabled for 8 seconds. If target foe is using a skill, that skill is interrupted and disabled for an additional 5...11...12 seconds.
1054;Visage de l'ancêtre;Enchantment Spell. For 4...9...10 seconds, whenever target ally is hit by a melee attack, all adjacent foes lose all adrenaline and 3 Energy.
1055;Insécurité récurrente;Elite Hex Spell. For 10 seconds, target foe suffers from -1...4...5 Health degeneration. If that foe has another hex when Recurring Insecurity would end, it is reapplied.
1056;Fardeau de Kitah;Hex Spell. For 10 seconds, target foe moves 50% slower. When Kitah's Burden ends you gain 10...16...18 Energy.
1057;Instabilité psychique;Elite Spell. Interrupt the target foe's action. If that action was a skill, that foe and nearby foes are knocked down for 2...4...4 seconds. (50% failure chance with Fast Casting 4 or less.)
1059;Sceau du Mangeur de Maléfices;Signet. Target touched ally and up to 2...4...5 adjacent allies each lose one hex. You gain 1...3...4 Energy for each hex removed this way.
1061;Rétroaction;Spell. Target foe loses one enchantment. If an enchantment is removed in this way, that foe also loses 4...9...10 Energy.
1062;Larcin arcane;Spell. For 5...29...35 seconds, one random spell is disabled for target foe and Arcane Larceny is replaced by that spell.
1066;Vainqueur dépouillé;Elite Hex Spell. For 3...13...15 seconds, whenever target foe attacks or casts a spell on a creature with less Health, that foe loses 25...85...100 Health.
1067;Coup du fléau;Spell. Target foe takes 12...41...48 shadow damage. If that foe's Health is above 50%, you steal up to 12...41...48 Health.
1068;Frisson amer;Spell. Target foe is struck for 15...51...60 cold damage.  If that foe had more Health than you, Bitter Chill recharges instantly.
1069;Saveur de douleur;Spell. If target foe is below 50% Health, you gain 30...126...150 Health.
1070;Enchantements profanés;Spell. Target foe and all nearby foes take 6...49...60 shadow damage and 4...17...20 shadow damage for each enchantment on them.
1071;Frissons de terreur;Hex Spell. For 10...34...40 seconds, whenever target foe is struck for cold damage while using a skill, that foe is interrupted and you lose 10...6...5 Energy or Shivers of Dread ends.
1075;Nuée vampirique;Spell. Vampiric Swarm steals up to 15...51...60 Health from up to three foes in the area.
1076;Buveur de sang;Spell. If your Health is above 50%, you begin Bleeding for 10 seconds. Steal up to 20...56...65 Health from target foe.
1077;Morsure vampirique;Skill. Touch target foe to steal up to 29...65...74 Health.
1078;Morsure de bauge;Skill. Target touched foe takes 20...50...58 damage.
1079;Toucher de faiblesse;Skill. Target touched foe loses 5...41...50 Health and suffers from Weakness for 5...17...20 seconds.
1081;Vent de Teinai;Spell. Target foe and all adjacent foes take 10...34...40 cold damage. Burning foes struck by Teinai's Wind take an additional 40...72...80 damage and are interrupted.
1082;Flèche de choc;Spell. Send out a shocking arrow that flies swiftly toward target foe, striking for 5...41...50 lightning damage. If Shock Arrow strikes a foe suffering from Cracked Armor, you gain 5 Energy plus 1 Energy for every 2 ranks of Energy Storage. Shock Arrow has 25% armor penetration.
1083;Sol instable;Elite Spell. You create Unsteady Ground at target foe's location. For 5 seconds, nearby foes take 10...34...40 earth damage each second. Attacking foes struck by Unsteady Ground are knocked down.
1084;Armure d'éclats;Enchantment Spell. For 5...10...11 seconds, you have 25...45...50% chance to block attacks and whenever you are the target of a hostile spell or attack one nearby foe is struck for 5...29...35 earth damage.
1085;Explosion de cendres;Hex Spell. Target and adjacent foes are struck for 35...59...65 earth damage. Burning foes struck by Ash Blast are hexed for 5 seconds and have a 20...64...75% chance to miss with attacks.
1086;Pas du dragon;Spell. You invoke a Dragon's Stomp at target foe's location. All foes near this location are knocked down and are struck for 26...85...100 earth damage.
1088;Seconde chance;Elite Spell. You gain 1 Energy and 5 Health for each point of Energy restricted by Overcast. You lose all enchantments.
1090;Ambres ardents;Hex Spell. Target foe is struck for 10...58...70 fire damage. If you are Overcast, that foe is hexed with Smoldering Embers for 3 seconds and takes 5...21...25 additional fire damage each second.
1091;Double dragon;Elite Enchantment Spell. Invoke the power of the Dragon. For 8 seconds, you and target ally are enchanted with Double Dragon. Adjacent foes are dealt 5...25...30 fire damage each second. Additionally, when you or your ally use skills that target a foe, that foe is set on fire for 0...2...3 second[s].
1093;Chaleur de Teinai;Ward Spell. Place a ward of Teinai's Heat at your location for 10...14...15 seconds. Foes within the ward suffer 2...4...5 health [sic] degeneration. Weakened foes attack 33% slower. This skill is disabled for 20 seconds.
1094;Souffle de Feu;Spell. Create Breath of Fire at target foe's current location.  For 5 seconds, foes adjacent to that location are struck for 10...34...40 fire damage each second.
1095;Eclat constellé;Elite Spell. Target touched foe and all foes in the area are struck for 7...91...112 fire damage and set on fire for 1...3...4 second[s]. For each foe you hit, gain 2 Energy.
1096;Glyphe d'essence;Glyph.  For 15 seconds, your next spell casts instantly but causes you to lose all Energy.
1097;Prison de Teinai;Hex Spell.  For 1...5...6 second[s], target foe's legs are encased in ice, causing the foe to move 66% slower. If that foe has Cracked Armor, the chill seeps through causing 5...8...9 Health degeneration.
1098;Miroir de glace;Elite Hex Spell. Shatter a Mirror of Ice. All foes near you and target ally take 15...59...70 cold damage and move 66% slower for 2...5...6 seconds. If you strike a foe hexed with Water Magic, Mirror of Ice recharges 50% faster.
1099;Cristaux de Teinai;Spell. Target foe takes 20...36...40 damage. If target foe has a Water Magic hex, this spell strikes target and nearby foes for an additional 20...36...40 damage, and nearby foes also suffer Cracked Armor for 5...13...15 seconds.
1113;Colère de Kirin;Spell. For 5 seconds, foes adjacent to the location in which the spell was cast take 8...27...32 holy damage each second.
1114;Lien spirituel;Enchantment Spell. For 8 seconds, whenever target ally takes more than 50 damage from the next 10 attacks or spells, that ally is healed for 30...78...90 Health.
1115;Atmosphère enchanteresse;Elite Enchantment Spell. For 4...9...10 seconds, enchantments cast on target other ally cost 5 less Energy (minimum 1 Energy).
1117;Paradis exquis;Spell. Heals you and party members within earshot for 15...51...60 points.
1118;Vague de guérison;Elite Spell. Target ally is healed for 10...130...160. All party members in earshot of your target gain Health equal to the Divine Favor bonus from this spell. Your Smiting Prayers are disabled for 20 seconds.
1119;Cercle de guérison de Karei;Spell. Heal yourself and all adjacent creatures for 30...150...180 points.
1120;Regard de Jamei;Spell. Heal target other ally for 35...151...180 Health.
1121;Don de santé;Spell. All of your other Healing Prayers skills are disabled for 10...6...5 seconds. Target other ally is healed for 15...123...150 Health.
1123;Bouclier de vie;Elite Enchantment Spell. Remove 0...2...2 condition[s] from target ally. For 8 seconds, the next time that ally would take damage or life steal, that ally gains that amount of Health instead (maximum 20...84...100).
1126;Suppression empathique;Elite Spell. You and target other ally lose 1 condition and 1 hex, and are healed for 50.
1128;Chant de résurrection;Spell. Resurrect target party member with up to your current Health and 5...29...35% Energy. This spell has half the normal range.
1129;Parole du censeur;Elite Spell. Target foe takes 15...63...75 holy damage. If your target was below 33% Health, Word of Censure takes 20 additional seconds to recharge.
1130;Lance de lumière;Spell. Spear of Light flies toward target foe and deals 26...50...56 holy damage if it hits. Spear of Light deals +15...51...60 damage if it hits an attacking foe.
1131;Coup d'Amederoc;Skill. Touched target foe takes 10...46...55 holy damage. If knocked down, your target takes an additional 10...46...55 holy damage.
1133;Attaque d'ivresse;Melee Attack. If this attack hits, you strike for +10...34...40 damage and your target suffers from one of the following conditions: Deep Wound (for 20 seconds), Weakness (for 20 seconds), Bleeding (for 25 seconds), or Crippled (for 15 seconds). After making a Drunken Blow, you are knocked down.
1134;Frappe du Léviathan;Melee Attack. If this attack hits, you strike for +5...17...20 damage. If this attack is blocked, your target is knocked down and suffers 10...29...34 damage.
1135;Frappe de Jaizhenju;Sword Attack. If Jaizhenju Strike hits, you strike for +1...24...30 damage. If you are not using a stance, Jaizhenju Strike cannot be blocked.
1136;Taillade pénétrante;Axe Attack. If this attack hits, you strike for +5...17...20 damage. This axe attack has 20% armor penetration.
1137;Frappe du Yéti;Hammer Attack. Lose all adrenaline. Attack all adjacent foes. If this attack strikes a foe suffering from a condition, that foe is knocked down. (50% failure chance with Hammer Mastery 4 or less.)
1140;Tempête d'épées;Skill. For 15 seconds, you and all adjacent allies deal 25 damage to all adjacent foes each second.
1141;"Vous mourrez !";Shout. If target foe is below 50% Health, you gain 1...3...3 strike[s] of adrenaline.
1142;Parade propice;Elite Stance. For 8 seconds, the next attack against you is blocked. You gain 1...3...4 strike[s] of adrenaline when this stance ends.
1144;Attaque d'Aildargent;Sword Attack. This attack strikes for +1...32...40 damage if it hits.
1146;Poussée;Elite Skill. Target touched foe is knocked down. If that foe was moving, that foe's stance ends and that foe takes 15...63...75 damage before being knocked down.
1191;Attaque éclatante;Bow Attack. If Sundering Attack hits, you strike for +5...21...25 damage and this attack has 10% armor penetration.
1192;Tir de Zojun;Bow Attack. Shoot an arrow that has half the normal range, but strikes for +10...34...40 damage.
1194;Lien du prédateur;Shout. For 5...17...20 seconds, your animal companion attacks 25% faster and heals you for 1...25...31 Health with each successful attack.
1195;Guérison partagée;Elite Skill. For 15 seconds, your animal companion steals 1...16...20 Health whenever it hits with an attack. You and your companion are both healed for 20...87...104 Health. If your companion is dead, it's resurrected with 50% Health. If you have this skill equipped, your companion will travel with you.
1196;Hâte de Zojun;Stance. For 5...10...11 seconds, you move 33% faster and have a 27...65...75% chance to block incoming projectiles. Zojun's Haste ends if you attack.
1197;Aiguillons;Bow Attack. Needling Shot strikes for only 10...26...30 damage and moves faster than normal.  If Needling Shot strikes a foe below 50% Health, Needling Shot recharges instantly. Your other attack skills are disabled for 2 seconds.
1198;Flèche à pointe large;Elite Bow Attack. You shoot a broad head arrow that moves slower than normal. If it hits, target foe is Dazed for 5...17...20 seconds, and if target foe is casting a spell that spell is interrupted.
1199;Flèches de verre;Elite Preparation. For 10...30...35 seconds, your arrows strike for +5...17...20 damage if they hit and cause Bleeding for 10...18...20 seconds if they are blocked.
1200;Sceau de l'Archer;Elite Signet. For 1...19...24 second[s], conditions you apply while wielding a bow last 100% longer.
1201;Attaque sauvage;Pet Attack. Your animal companion attempts a Savage Pounce that deals +5...17...20 damage. If the attack strikes a foe who is casting a spell, that foe is knocked down.
1202;Coup enragé;Elite Pet Attack. Your animal companion attempts an Enraged Lunge that applies a Deep Wound to target foe for 5...17...20 seconds and deals +10...42...50 damage.
1203;Violence bestiale;Pet Attack. Your animal companion attempts a Bestial Mauling that deals  +5...17...20 damage. If the attack strikes a knocked-down foe, that foe is Dazed for 4...9...10 seconds.
1205;Morsure empoisonnée;Pet Attack. Your animal companion attempts a Poisonous Bite that Poisons target foe for 5...17...20 seconds.
1206;Bond;Pet Attack. Your animal companion's next attack is a Pounce that deals +5...17...20 damage. If the attack strikes a moving foe, that foe is knocked down.
1209;Furie bestiale;Stance.  All your non-attack skills are disabled for 5 seconds. For 5...10...11 seconds, you attack 25% faster.
1211;Nid de vipère;Trap. Create a Viper's Nest. When it is triggered, all nearby foes are struck for 5...29...35 piercing damage and become Poisoned for 5...17...20 seconds. Viper's Nest expires after 90 seconds. This Trap is easily interrupted.
1212;Equinoxe;Elite Nature Ritual. Create a level 1...8...10 spirit. Spells cast within its range that cause Overcast cause an additional 10 Overcast. This spirit dies after 30...126...150 seconds.
1213;Tranquillité;Nature Ritual. Create a level 1...8...10 spirit. Enchantments cast by non-spirit creatures within its range expire 20...44...50% faster.  This spirit dies after 15...51...60 seconds.
1215;Clameur des âmes;Elite Spell. Target foe and all nearby foes take 10...54...65 lightning damage. If you are within earshot of a spirit or holding a bundle item, you gain 10 Energy.
1217;Seigneur de rituel;Elite Skill. For 5...29...35 seconds, your Ritualist attributes are boosted by 2...4...4 for your next skill. If that skill is a Binding Ritual, it recharges 10...50...60% faster and Ritual Lord recharges instantly.
